firm_id,firm_name,description_firm,website,logo,inactif
1,Tazzy,"Cras mi pede, malesuada in, imperdiet et, commodo vulputate, justo. In blandit ultrices enim. Lorem ipsum dolor sit amet, consectetuer adipiscing elit.

Proin interdum mauris non ligula pellentesque ultrices. Phasellus id sapien in sapien iaculis congue. Vivamus metus arcu, adipiscing molestie, hendrerit at, vulputate vitae, nisl.",http://google.com.au/nulla/neque/libero/convallis/eget/eleifend.png?non=massa&mattis=id&pulvinar=nisl&nulla=venenatis&pede=lacinia&ullamcorper=aenean&augue=sit&a=amet&suscipit=justo&nulla=morbi&elit=ut&ac=odio&nulla=cras&sed=mi&vel=pede&enim=malesuada&sit=in&amet=imperdiet&nunc=et&viverra=commodo&dapibus=vulputate&nulla=justo&suscipit=in&ligula=blandit&in=ultrices,http://dummyimage.com/129x100.png/ff4444/ffffff,false
2,Feedbug,"Fusce consequat. Nulla nisl. Nunc nisl.

Duis bibendum, felis sed interdum venenatis, turpis enim blandit mi, in porttitor pede justo eu massa. Donec dapibus. Duis at velit eu est congue elementum.",https://hud.gov/diam/cras/pellentesque/volutpat/dui/maecenas/tristique.jpg?aliquet=rutrum&pulvinar=rutrum&sed=neque&nisl=aenean&nunc=auctor&rhoncus=gravida&dui=sem&vel=praesent&sem=id&sed=massa&sagittis=id&nam=nisl&congue=venenatis&risus=lacinia&semper=aenean&porta=sit&volutpat=amet&quam=justo&pede=morbi&lobortis=ut&ligula=odio&sit=cras&amet=mi&eleifend=pede&pede=malesuada&libero=in&quis=imperdiet&orci=et&nullam=commodo&molestie=vulputate&nibh=justo&in=in&lectus=blandit&pellentesque=ultrices&at=enim&nulla=lorem&suspendisse=ipsum&potenti=dolor&cras=sit&in=amet&purus=consectetuer&eu=adipiscing&magna=elit&vulputate=proin&luctus=interdum&cum=mauris&sociis=non&natoque=ligula&penatibus=pellentesque&et=ultrices&magnis=phasellus&dis=id&parturient=sapien&montes=in&nascetur=sapien&ridiculus=iaculis&mus=congue&vivamus=vivamus&vestibulum=metus&sagittis=arcu&sapien=adipiscing&cum=molestie&sociis=hendrerit&natoque=at&penatibus=vulputate&et=vitae&magnis=nisl&dis=aenean&parturient=lectus&montes=pellentesque&nascetur=eget&ridiculus=nunc&mus=donec&etiam=quis&vel=orci&augue=eget&vestibulum=orci&rutrum=vehicula&rutrum=condimentum&neque=curabitur&aenean=in&auctor=libero&gravida=ut&sem=massa&praesent=volutpat&id=convallis&massa=morbi&id=odio&nisl=odio&venenatis=elementum&lacinia=eu&aenean=interdum&sit=eu&amet=tincidunt&justo=in&morbi=leo&ut=maecenas,http://dummyimage.com/189x100.png/cc0000/ffffff,false
3,Oba,"Integer ac leo. Pellentesque ultrices mattis odio. Donec vitae nisi.

Nam ultrices, libero non mattis pulvinar, nulla pede ullamcorper augue, a suscipit nulla elit ac nulla. Sed vel enim sit amet nunc viverra dapibus. Nulla suscipit ligula in lacus.",http://usatoday.com/venenatis/tristique.html?mus=aliquet&etiam=ultrices&vel=erat&augue=tortor&vestibulum=sollicitudin&rutrum=mi&rutrum=sit&neque=amet&aenean=lobortis&auctor=sapien&gravida=sapien&sem=non&praesent=mi&id=integer&massa=ac&id=neque&nisl=duis&venenatis=bibendum&lacinia=morbi&aenean=non&sit=quam&amet=nec&justo=dui&morbi=luctus&ut=rutrum&odio=nulla&cras=tellus&mi=in&pede=sagittis&malesuada=dui&in=vel&imperdiet=nisl&et=duis&commodo=ac&vulputate=nibh&justo=fusce&in=lacus&blandit=purus&ultrices=aliquet&enim=at&lorem=feugiat&ipsum=non&dolor=pretium&sit=quis&amet=lectus&consectetuer=suspendisse&adipiscing=potenti&elit=in&proin=eleifend&interdum=quam&mauris=a&non=odio&ligula=in&pellentesque=hac&ultrices=habitasse&phasellus=platea&id=dictumst&sapien=maecenas&in=ut&sapien=massa&iaculis=quis&congue=augue&vivamus=luctus&metus=tincidunt&arcu=nulla&adipiscing=mollis&molestie=molestie&hendrerit=lorem&at=quisque&vulputate=ut&vitae=erat&nisl=curabitur&aenean=gravida&lectus=nisi&pellentesque=at&eget=nibh&nunc=in&donec=hac&quis=habitasse&orci=platea&eget=dictumst&orci=aliquam&vehicula=augue&condimentum=quam&curabitur=sollicitudin&in=vitae&libero=consectetuer&ut=eget&massa=rutrum&volutpat=at&convallis=lorem&morbi=integer&odio=tincidunt&odio=ante&elementum=vel,http://dummyimage.com/206x100.png/5fa2dd/ffffff,false
4,Yozio,"In sagittis dui vel nisl. Duis ac nibh. Fusce lacus purus, aliquet at, feugiat non, pretium quis, lectus.

Suspendisse potenti. In eleifend quam a odio. In hac habitasse platea dictumst.

Maecenas ut massa quis augue luctus tincidunt. Nulla mollis molestie lorem. Quisque ut erat.",https://uol.com.br/lacus/at/velit.js?non=posuere&sodales=felis&sed=sed&tincidunt=lacus&eu=morbi&felis=sem&fusce=mauris&posuere=laoreet&felis=ut&sed=rhoncus&lacus=aliquet&morbi=pulvinar&sem=sed&mauris=nisl&laoreet=nunc&ut=rhoncus&rhoncus=dui&aliquet=vel&pulvinar=sem&sed=sed&nisl=sagittis&nunc=nam&rhoncus=congue&dui=risus&vel=semper&sem=porta&sed=volutpat&sagittis=quam&nam=pede&congue=lobortis&risus=ligula&semper=sit&porta=amet&volutpat=eleifend&quam=pede&pede=libero&lobortis=quis&ligula=orci&sit=nullam&amet=molestie&eleifend=nibh&pede=in&libero=lectus&quis=pellentesque&orci=at&nullam=nulla&molestie=suspendisse&nibh=potenti&in=cras&lectus=in&pellentesque=purus,http://dummyimage.com/123x100.png/dddddd/000000,true
5,Izio,Sed ante. Vivamus tortor. Duis mattis egestas metus.,http://google.de/bibendum/imperdiet/nullam/orci/pede/venenatis.jpg?morbi=magna&vel=vulputate&lectus=luctus&in=cum&quam=sociis&fringilla=natoque&rhoncus=penatibus&mauris=et&enim=magnis&leo=dis&rhoncus=parturient&sed=montes&vestibulum=nascetur&sit=ridiculus&amet=mus&cursus=vivamus&id=vestibulum&turpis=sagittis&integer=sapien&aliquet=cum&massa=sociis&id=natoque&lobortis=penatibus&convallis=et&tortor=magnis&risus=dis&dapibus=parturient&augue=montes&vel=nascetur&accumsan=ridiculus&tellus=mus&nisi=etiam&eu=vel&orci=augue&mauris=vestibulum&lacinia=rutrum&sapien=rutrum&quis=neque&libero=aenean&nullam=auctor&sit=gravida&amet=sem&turpis=praesent&elementum=id&ligula=massa&vehicula=id&consequat=nisl&morbi=venenatis&a=lacinia&ipsum=aenean&integer=sit&a=amet&nibh=justo&in=morbi&quis=ut&justo=odio&maecenas=cras&rhoncus=mi&aliquam=pede&lacus=malesuada&morbi=in&quis=imperdiet&tortor=et&id=commodo&nulla=vulputate&ultrices=justo&aliquet=in&maecenas=blandit&leo=ultrices&odio=enim&condimentum=lorem&id=ipsum&luctus=dolor,http://dummyimage.com/162x100.png/ff4444/ffffff,true
6,Oyonder,"Donec diam neque, vestibulum eget, vulputate ut, ultrices vel, augue. Vestibulum ante ipsum primis in faucibus orci luctus et ultrices posuere cubilia Curae; Donec pharetra, magna vestibulum aliquet ultrices, erat tortor sollicitudin mi, sit amet lobortis sapien sapien non mi. Integer ac neque.

Duis bibendum. Morbi non quam nec dui luctus rutrum. Nulla tellus.

In sagittis dui vel nisl. Duis ac nibh. Fusce lacus purus, aliquet at, feugiat non, pretium quis, lectus.",https://youtube.com/curae/mauris/viverra/diam/vitae/quam/suspendisse.js?nulla=sit&tellus=amet&in=cursus&sagittis=id&dui=turpis&vel=integer&nisl=aliquet&duis=massa&ac=id&nibh=lobortis&fusce=convallis&lacus=tortor&purus=risus&aliquet=dapibus&at=augue&feugiat=vel&non=accumsan&pretium=tellus&quis=nisi&lectus=eu&suspendisse=orci&potenti=mauris&in=lacinia&eleifend=sapien&quam=quis&a=libero&odio=nullam&in=sit&hac=amet&habitasse=turpis&platea=elementum&dictumst=ligula&maecenas=vehicula&ut=consequat&massa=morbi&quis=a&augue=ipsum&luctus=integer&tincidunt=a&nulla=nibh&mollis=in&molestie=quis&lorem=justo&quisque=maecenas&ut=rhoncus&erat=aliquam&curabitur=lacus&gravida=morbi&nisi=quis&at=tortor&nibh=id&in=nulla&hac=ultrices&habitasse=aliquet&platea=maecenas&dictumst=leo&aliquam=odio&augue=condimentum&quam=id&sollicitudin=luctus&vitae=nec&consectetuer=molestie&eget=sed&rutrum=justo&at=pellentesque&lorem=viverra&integer=pede&tincidunt=ac&ante=diam&vel=cras&ipsum=pellentesque&praesent=volutpat&blandit=dui&lacinia=maecenas,http://dummyimage.com/189x100.png/5fa2dd/ffffff,true
7,InnoZ,Cras non velit nec nisi vulputate nonummy. Maecenas tincidunt lacus at velit. Vivamus vel nulla eget eros elementum pellentesque.,https://hp.com/metus/aenean.png?quisque=accumsan&erat=felis&eros=ut&viverra=at&eget=dolor&congue=quis&eget=odio&semper=consequat&rutrum=varius&nulla=integer&nunc=ac&purus=leo&phasellus=pellentesque&in=ultrices&felis=mattis&donec=odio&semper=donec&sapien=vitae&a=nisi&libero=nam&nam=ultrices&dui=libero&proin=non&leo=mattis&odio=pulvinar&porttitor=nulla&id=pede&consequat=ullamcorper&in=augue&consequat=a&ut=suscipit&nulla=nulla&sed=elit&accumsan=ac&felis=nulla&ut=sed&at=vel&dolor=enim&quis=sit&odio=amet&consequat=nunc&varius=viverra&integer=dapibus&ac=nulla&leo=suscipit&pellentesque=ligula&ultrices=in&mattis=lacus&odio=curabitur&donec=at&vitae=ipsum&nisi=ac&nam=tellus&ultrices=semper&libero=interdum&non=mauris&mattis=ullamcorper&pulvinar=purus&nulla=sit&pede=amet&ullamcorper=nulla&augue=quisque&a=arcu,http://dummyimage.com/241x100.png/ff4444/ffffff,false
8,Trilia,"Sed sagittis. Nam congue, risus semper porta volutpat, quam pede lobortis ligula, sit amet eleifend pede libero quis orci. Nullam molestie nibh in lectus.",https://npr.org/varius/nulla/facilisi/cras.html?at=mauris&turpis=morbi&a=non&pede=lectus&posuere=aliquam&nonummy=sit&integer=amet&non=diam&velit=in&donec=magna&diam=bibendum&neque=imperdiet&vestibulum=nullam&eget=orci&vulputate=pede&ut=venenatis&ultrices=non&vel=sodales&augue=sed&vestibulum=tincidunt&ante=eu&ipsum=felis&primis=fusce&in=posuere&faucibus=felis&orci=sed&luctus=lacus&et=morbi&ultrices=sem&posuere=mauris&cubilia=laoreet&curae=ut&donec=rhoncus&pharetra=aliquet&magna=pulvinar&vestibulum=sed&aliquet=nisl&ultrices=nunc&erat=rhoncus&tortor=dui&sollicitudin=vel&mi=sem&sit=sed&amet=sagittis&lobortis=nam&sapien=congue&sapien=risus&non=semper&mi=porta&integer=volutpat&ac=quam&neque=pede&duis=lobortis&bibendum=ligula&morbi=sit&non=amet&quam=eleifend&nec=pede&dui=libero,http://dummyimage.com/204x100.png/ff4444/ffffff,true
9,Lazz,"Quisque id justo sit amet sapien dignissim vestibulum. Vestibulum ante ipsum primis in faucibus orci luctus et ultrices posuere cubilia Curae; Nulla dapibus dolor vel est. Donec odio justo, sollicitudin ut, suscipit a, feugiat et, eros.

Vestibulum ac est lacinia nisi venenatis tristique. Fusce congue, diam id ornare imperdiet, sapien urna pretium nisl, ut volutpat sapien arcu sed augue. Aliquam erat volutpat.

In congue. Etiam justo. Etiam pretium iaculis justo.",http://geocities.jp/ridiculus.jsp?in=tincidunt&faucibus=in&orci=leo&luctus=maecenas&et=pulvinar&ultrices=lobortis&posuere=est&cubilia=phasellus&curae=sit&mauris=amet&viverra=erat&diam=nulla&vitae=tempus&quam=vivamus&suspendisse=in&potenti=felis&nullam=eu&porttitor=sapien&lacus=cursus&at=vestibulum&turpis=proin&donec=eu&posuere=mi&metus=nulla&vitae=ac&ipsum=enim&aliquam=in&non=tempor&mauris=turpis&morbi=nec&non=euismod&lectus=scelerisque&aliquam=quam&sit=turpis&amet=adipiscing&diam=lorem&in=vitae&magna=mattis&bibendum=nibh&imperdiet=ligula&nullam=nec&orci=sem&pede=duis&venenatis=aliquam&non=convallis,http://dummyimage.com/103x100.png/5fa2dd/ffffff,false
10,Browsedrive,"Duis aliquam convallis nunc. Proin at turpis a pede posuere nonummy. Integer non velit.

Donec diam neque, vestibulum eget, vulputate ut, ultrices vel, augue. Vestibulum ante ipsum primis in faucibus orci luctus et ultrices posuere cubilia Curae; Donec pharetra, magna vestibulum aliquet ultrices, erat tortor sollicitudin mi, sit amet lobortis sapien sapien non mi. Integer ac neque.",http://mapquest.com/varius.jsp?fusce=vivamus&congue=vel&diam=nulla&id=eget&ornare=eros&imperdiet=elementum&sapien=pellentesque&urna=quisque&pretium=porta&nisl=volutpat&ut=erat&volutpat=quisque&sapien=erat&arcu=eros&sed=viverra&augue=eget&aliquam=congue&erat=eget&volutpat=semper&in=rutrum&congue=nulla&etiam=nunc&justo=purus&etiam=phasellus&pretium=in&iaculis=felis&justo=donec&in=semper&hac=sapien&habitasse=a&platea=libero&dictumst=nam&etiam=dui&faucibus=proin&cursus=leo&urna=odio&ut=porttitor&tellus=id&nulla=consequat&ut=in&erat=consequat&id=ut&mauris=nulla,http://dummyimage.com/187x100.png/ff4444/ffffff,true
11,Yombu,"Cum sociis natoque penatibus et magnis dis parturient montes, nascetur ridiculus mus. Vivamus vestibulum sagittis sapien. Cum sociis natoque penatibus et magnis dis parturient montes, nascetur ridiculus mus.

Etiam vel augue. Vestibulum rutrum rutrum neque. Aenean auctor gravida sem.",http://webeden.co.uk/eget/congue/eget/semper/rutrum.aspx?nec=consectetuer&molestie=adipiscing&sed=elit&justo=proin&pellentesque=risus&viverra=praesent&pede=lectus&ac=vestibulum&diam=quam&cras=sapien&pellentesque=varius&volutpat=ut&dui=blandit&maecenas=non&tristique=interdum&est=in&et=ante&tempus=vestibulum&semper=ante&est=ipsum&quam=primis&pharetra=in&magna=faucibus&ac=orci&consequat=luctus&metus=et&sapien=ultrices&ut=posuere&nunc=cubilia&vestibulum=curae&ante=duis&ipsum=faucibus&primis=accumsan&in=odio&faucibus=curabitur&orci=convallis&luctus=duis&et=consequat&ultrices=dui&posuere=nec&cubilia=nisi&curae=volutpat&mauris=eleifend&viverra=donec&diam=ut&vitae=dolor&quam=morbi&suspendisse=vel&potenti=lectus&nullam=in&porttitor=quam&lacus=fringilla&at=rhoncus&turpis=mauris&donec=enim&posuere=leo&metus=rhoncus&vitae=sed&ipsum=vestibulum&aliquam=sit&non=amet&mauris=cursus&morbi=id&non=turpis&lectus=integer&aliquam=aliquet&sit=massa&amet=id&diam=lobortis&in=convallis&magna=tortor&bibendum=risus&imperdiet=dapibus&nullam=augue&orci=vel&pede=accumsan&venenatis=tellus&non=nisi&sodales=eu,http://dummyimage.com/112x100.png/dddddd/000000,false
12,Wikivu,"Fusce consequat. Nulla nisl. Nunc nisl.

Duis bibendum, felis sed interdum venenatis, turpis enim blandit mi, in porttitor pede justo eu massa. Donec dapibus. Duis at velit eu est congue elementum.",http://jiathis.com/luctus.png?ipsum=id&primis=massa&in=id&faucibus=nisl&orci=venenatis&luctus=lacinia&et=aenean&ultrices=sit&posuere=amet&cubilia=justo&curae=morbi&donec=ut&pharetra=odio&magna=cras&vestibulum=mi&aliquet=pede&ultrices=malesuada&erat=in&tortor=imperdiet&sollicitudin=et&mi=commodo&sit=vulputate&amet=justo&lobortis=in&sapien=blandit&sapien=ultrices&non=enim&mi=lorem&integer=ipsum&ac=dolor&neque=sit&duis=amet&bibendum=consectetuer&morbi=adipiscing&non=elit&quam=proin&nec=interdum&dui=mauris&luctus=non&rutrum=ligula&nulla=pellentesque&tellus=ultrices&in=phasellus&sagittis=id&dui=sapien&vel=in&nisl=sapien&duis=iaculis&ac=congue&nibh=vivamus&fusce=metus&lacus=arcu,http://dummyimage.com/193x100.png/cc0000/ffffff,true
13,Pixonyx,"Phasellus sit amet erat. Nulla tempus. Vivamus in felis eu sapien cursus vestibulum.

Proin eu mi. Nulla ac enim. In tempor, turpis nec euismod scelerisque, quam turpis adipiscing lorem, vitae mattis nibh ligula nec sem.",https://walmart.com/in/hac.xml?hac=aliquet&habitasse=ultrices&platea=erat&dictumst=tortor&maecenas=sollicitudin&ut=mi&massa=sit&quis=amet&augue=lobortis&luctus=sapien&tincidunt=sapien&nulla=non&mollis=mi&molestie=integer,http://dummyimage.com/147x100.png/5fa2dd/ffffff,false
14,Skibox,"Quisque id justo sit amet sapien dignissim vestibulum. Vestibulum ante ipsum primis in faucibus orci luctus et ultrices posuere cubilia Curae; Nulla dapibus dolor vel est. Donec odio justo, sollicitudin ut, suscipit a, feugiat et, eros.

Vestibulum ac est lacinia nisi venenatis tristique. Fusce congue, diam id ornare imperdiet, sapien urna pretium nisl, ut volutpat sapien arcu sed augue. Aliquam erat volutpat.

In congue. Etiam justo. Etiam pretium iaculis justo.",https://cnn.com/nunc/donec/quis/orci/eget/orci.jsp?in=viverra&felis=eget&donec=congue&semper=eget&sapien=semper&a=rutrum&libero=nulla&nam=nunc&dui=purus&proin=phasellus&leo=in&odio=felis&porttitor=donec&id=semper&consequat=sapien&in=a&consequat=libero&ut=nam&nulla=dui&sed=proin&accumsan=leo&felis=odio&ut=porttitor&at=id&dolor=consequat&quis=in&odio=consequat&consequat=ut&varius=nulla&integer=sed&ac=accumsan&leo=felis,http://dummyimage.com/231x100.png/5fa2dd/ffffff,true
15,Tavu,"Cum sociis natoque penatibus et magnis dis parturient montes, nascetur ridiculus mus. Vivamus vestibulum sagittis sapien. Cum sociis natoque penatibus et magnis dis parturient montes, nascetur ridiculus mus.

Etiam vel augue. Vestibulum rutrum rutrum neque. Aenean auctor gravida sem.",https://nps.gov/gravida/nisi/at.xml?elit=amet&sodales=justo&scelerisque=morbi&mauris=ut&sit=odio&amet=cras&eros=mi&suspendisse=pede&accumsan=malesuada&tortor=in&quis=imperdiet&turpis=et&sed=commodo&ante=vulputate&vivamus=justo&tortor=in&duis=blandit&mattis=ultrices&egestas=enim&metus=lorem&aenean=ipsum&fermentum=dolor&donec=sit&ut=amet&mauris=consectetuer&eget=adipiscing&massa=elit&tempor=proin&convallis=interdum&nulla=mauris&neque=non&libero=ligula&convallis=pellentesque&eget=ultrices&eleifend=phasellus&luctus=id&ultricies=sapien&eu=in&nibh=sapien&quisque=iaculis&id=congue&justo=vivamus&sit=metus&amet=arcu&sapien=adipiscing&dignissim=molestie&vestibulum=hendrerit&vestibulum=at&ante=vulputate&ipsum=vitae&primis=nisl&in=aenean&faucibus=lectus&orci=pellentesque&luctus=eget&et=nunc&ultrices=donec&posuere=quis&cubilia=orci&curae=eget&nulla=orci&dapibus=vehicula&dolor=condimentum&vel=curabitur&est=in&donec=libero&odio=ut&justo=massa&sollicitudin=volutpat&ut=convallis&suscipit=morbi&a=odio&feugiat=odio&et=elementum&eros=eu&vestibulum=interdum&ac=eu&est=tincidunt&lacinia=in&nisi=leo&venenatis=maecenas&tristique=pulvinar&fusce=lobortis&congue=est&diam=phasellus&id=sit&ornare=amet&imperdiet=erat&sapien=nulla,http://dummyimage.com/162x100.png/dddddd/000000,false
16,Fiveclub,"In congue. Etiam justo. Etiam pretium iaculis justo.

In hac habitasse platea dictumst. Etiam faucibus cursus urna. Ut tellus.

Nulla ut erat id mauris vulputate elementum. Nullam varius. Nulla facilisi.",https://nationalgeographic.com/nisi/vulputate/nonummy/maecenas.jpg?in=arcu&felis=sed&donec=augue&semper=aliquam&sapien=erat&a=volutpat&libero=in&nam=congue&dui=etiam&proin=justo&leo=etiam&odio=pretium&porttitor=iaculis&id=justo&consequat=in&in=hac&consequat=habitasse&ut=platea&nulla=dictumst&sed=etiam&accumsan=faucibus&felis=cursus&ut=urna&at=ut&dolor=tellus&quis=nulla&odio=ut&consequat=erat&varius=id&integer=mauris&ac=vulputate&leo=elementum&pellentesque=nullam&ultrices=varius&mattis=nulla&odio=facilisi&donec=cras&vitae=non&nisi=velit&nam=nec&ultrices=nisi&libero=vulputate&non=nonummy&mattis=maecenas&pulvinar=tincidunt&nulla=lacus&pede=at&ullamcorper=velit&augue=vivamus&a=vel&suscipit=nulla&nulla=eget&elit=eros&ac=elementum&nulla=pellentesque&sed=quisque&vel=porta&enim=volutpat&sit=erat&amet=quisque&nunc=erat&viverra=eros&dapibus=viverra&nulla=eget&suscipit=congue&ligula=eget&in=semper&lacus=rutrum&curabitur=nulla&at=nunc&ipsum=purus&ac=phasellus&tellus=in&semper=felis&interdum=donec&mauris=semper&ullamcorper=sapien&purus=a&sit=libero&amet=nam&nulla=dui&quisque=proin&arcu=leo&libero=odio&rutrum=porttitor&ac=id&lobortis=consequat,http://dummyimage.com/242x100.png/5fa2dd/ffffff,true
17,Dynabox,"Fusce posuere felis sed lacus. Morbi sem mauris, laoreet ut, rhoncus aliquet, pulvinar sed, nisl. Nunc rhoncus dui vel sem.

Sed sagittis. Nam congue, risus semper porta volutpat, quam pede lobortis ligula, sit amet eleifend pede libero quis orci. Nullam molestie nibh in lectus.

Pellentesque at nulla. Suspendisse potenti. Cras in purus eu magna vulputate luctus.",https://weather.com/mi/pede.png?phasellus=nibh&in=in&felis=hac&donec=habitasse&semper=platea&sapien=dictumst&a=aliquam&libero=augue&nam=quam&dui=sollicitudin,http://dummyimage.com/144x100.png/5fa2dd/ffffff,false
18,Dablist,Praesent id massa id nisl venenatis lacinia. Aenean sit amet justo. Morbi ut odio.,https://dion.ne.jp/etiam/vel/augue/vestibulum/rutrum/rutrum.js?quis=luctus&libero=nec&nullam=molestie&sit=sed&amet=justo&turpis=pellentesque&elementum=viverra&ligula=pede&vehicula=ac&consequat=diam&morbi=cras&a=pellentesque&ipsum=volutpat&integer=dui&a=maecenas&nibh=tristique&in=est&quis=et&justo=tempus&maecenas=semper&rhoncus=est&aliquam=quam&lacus=pharetra&morbi=magna&quis=ac&tortor=consequat&id=metus&nulla=sapien&ultrices=ut&aliquet=nunc&maecenas=vestibulum&leo=ante&odio=ipsum&condimentum=primis&id=in&luctus=faucibus&nec=orci&molestie=luctus&sed=et&justo=ultrices&pellentesque=posuere&viverra=cubilia&pede=curae&ac=mauris&diam=viverra&cras=diam&pellentesque=vitae&volutpat=quam&dui=suspendisse&maecenas=potenti&tristique=nullam&est=porttitor&et=lacus&tempus=at&semper=turpis&est=donec&quam=posuere&pharetra=metus&magna=vitae&ac=ipsum,http://dummyimage.com/118x100.png/dddddd/000000,true
19,Topicstorm,"Integer tincidunt ante vel ipsum. Praesent blandit lacinia erat. Vestibulum sed magna at nunc commodo placerat.

Praesent blandit. Nam nulla. Integer pede justo, lacinia eget, tincidunt eget, tempus vel, pede.

Morbi porttitor lorem id ligula. Suspendisse ornare consequat lectus. In est risus, auctor sed, tristique in, tempus sit amet, sem.",https://harvard.edu/elementum.xml?morbi=sollicitudin&vestibulum=ut&velit=suscipit&id=a&pretium=feugiat&iaculis=et&diam=eros&erat=vestibulum&fermentum=ac&justo=est&nec=lacinia&condimentum=nisi&neque=venenatis&sapien=tristique&placerat=fusce&ante=congue&nulla=diam&justo=id&aliquam=ornare&quis=imperdiet&turpis=sapien&eget=urna&elit=pretium&sodales=nisl,http://dummyimage.com/199x100.png/dddddd/000000,true
20,Teklist,"Morbi non lectus. Aliquam sit amet diam in magna bibendum imperdiet. Nullam orci pede, venenatis non, sodales sed, tincidunt eu, felis.

Fusce posuere felis sed lacus. Morbi sem mauris, laoreet ut, rhoncus aliquet, pulvinar sed, nisl. Nunc rhoncus dui vel sem.

Sed sagittis. Nam congue, risus semper porta volutpat, quam pede lobortis ligula, sit amet eleifend pede libero quis orci. Nullam molestie nibh in lectus.",https://businessweek.com/mi/pede/malesuada/in/imperdiet/et.xml?consequat=amet&lectus=erat&in=nulla&est=tempus&risus=vivamus&auctor=in&sed=felis&tristique=eu&in=sapien&tempus=cursus&sit=vestibulum&amet=proin&sem=eu&fusce=mi&consequat=nulla&nulla=ac&nisl=enim&nunc=in&nisl=tempor&duis=turpis&bibendum=nec&felis=euismod&sed=scelerisque&interdum=quam&venenatis=turpis&turpis=adipiscing&enim=lorem&blandit=vitae&mi=mattis&in=nibh&porttitor=ligula&pede=nec&justo=sem&eu=duis&massa=aliquam&donec=convallis&dapibus=nunc&duis=proin&at=at&velit=turpis&eu=a&est=pede&congue=posuere&elementum=nonummy&in=integer&hac=non&habitasse=velit&platea=donec&dictumst=diam&morbi=neque&vestibulum=vestibulum&velit=eget&id=vulputate&pretium=ut&iaculis=ultrices&diam=vel&erat=augue&fermentum=vestibulum&justo=ante&nec=ipsum&condimentum=primis&neque=in&sapien=faucibus&placerat=orci&ante=luctus&nulla=et&justo=ultrices&aliquam=posuere&quis=cubilia&turpis=curae&eget=donec&elit=pharetra&sodales=magna&scelerisque=vestibulum&mauris=aliquet&sit=ultrices&amet=erat&eros=tortor&suspendisse=sollicitudin&accumsan=mi&tortor=sit&quis=amet&turpis=lobortis&sed=sapien&ante=sapien&vivamus=non&tortor=mi&duis=integer&mattis=ac&egestas=neque&metus=duis,http://dummyimage.com/139x100.png/cc0000/ffffff,true
21,Mycat,Integer ac leo. Pellentesque ultrices mattis odio. Donec vitae nisi.,https://elegantthemes.com/sapien/varius/ut/blandit/non/interdum.html?nullam=cum&molestie=sociis&nibh=natoque&in=penatibus&lectus=et&pellentesque=magnis&at=dis&nulla=parturient&suspendisse=montes&potenti=nascetur&cras=ridiculus&in=mus&purus=vivamus&eu=vestibulum&magna=sagittis&vulputate=sapien&luctus=cum&cum=sociis&sociis=natoque&natoque=penatibus&penatibus=et&et=magnis&magnis=dis&dis=parturient&parturient=montes&montes=nascetur&nascetur=ridiculus&ridiculus=mus&mus=etiam&vivamus=vel&vestibulum=augue&sagittis=vestibulum&sapien=rutrum&cum=rutrum&sociis=neque&natoque=aenean&penatibus=auctor&et=gravida&magnis=sem&dis=praesent&parturient=id&montes=massa&nascetur=id&ridiculus=nisl&mus=venenatis&etiam=lacinia&vel=aenean&augue=sit&vestibulum=amet&rutrum=justo&rutrum=morbi&neque=ut&aenean=odio&auctor=cras&gravida=mi&sem=pede&praesent=malesuada&id=in&massa=imperdiet&id=et&nisl=commodo&venenatis=vulputate&lacinia=justo&aenean=in&sit=blandit&amet=ultrices&justo=enim&morbi=lorem&ut=ipsum&odio=dolor&cras=sit&mi=amet&pede=consectetuer,http://dummyimage.com/187x100.png/5fa2dd/ffffff,false
22,Trupe,Pellentesque at nulla. Suspendisse potenti. Cras in purus eu magna vulputate luctus.,http://rambler.ru/laoreet.json?sagittis=vel&dui=sem&vel=sed&nisl=sagittis,http://dummyimage.com/191x100.png/5fa2dd/ffffff,false
23,Kwimbee,"Vestibulum ac est lacinia nisi venenatis tristique. Fusce congue, diam id ornare imperdiet, sapien urna pretium nisl, ut volutpat sapien arcu sed augue. Aliquam erat volutpat.",http://photobucket.com/molestie/hendrerit/at/vulputate/vitae/nisl/aenean.json?neque=eget&aenean=nunc&auctor=donec&gravida=quis&sem=orci&praesent=eget&id=orci&massa=vehicula&id=condimentum&nisl=curabitur&venenatis=in&lacinia=libero&aenean=ut&sit=massa&amet=volutpat&justo=convallis&morbi=morbi&ut=odio&odio=odio&cras=elementum&mi=eu&pede=interdum&malesuada=eu&in=tincidunt&imperdiet=in&et=leo&commodo=maecenas&vulputate=pulvinar&justo=lobortis&in=est&blandit=phasellus&ultrices=sit&enim=amet&lorem=erat,http://dummyimage.com/121x100.png/ff4444/ffffff,true
24,Buzzdog,"Phasellus in felis. Donec semper sapien a libero. Nam dui.

Proin leo odio, porttitor id, consequat in, consequat ut, nulla. Sed accumsan felis. Ut at dolor quis odio consequat varius.",https://youtube.com/diam/in.xml?purus=erat&eu=volutpat&magna=in&vulputate=congue&luctus=etiam&cum=justo&sociis=etiam&natoque=pretium&penatibus=iaculis&et=justo&magnis=in&dis=hac,http://dummyimage.com/214x100.png/cc0000/ffffff,false
