firm_id,firm_name,description_firm,website,logo,inactif
128,Gabcube,"In sagittis dui vel nisl. Duis ac nibh. Fusce lacus purus, aliquet at, feugiat non, pretium quis, lectus.

Suspendisse potenti. In eleifend quam a odio. In hac habitasse platea dictumst.

Maecenas ut massa quis augue luctus tincidunt. Nulla mollis molestie lorem. Quisque ut erat.",http://princeton.edu/in/faucibus/orci/luctus/et.js?dolor=aliquam&quis=augue&odio=quam&consequat=sollicitudin&varius=vitae&integer=consectetuer&ac=eget&leo=rutrum&pellentesque=at&ultrices=lorem&mattis=integer&odio=tincidunt&donec=ante&vitae=vel&nisi=ipsum&nam=praesent&ultrices=blandit,http://dummyimage.com/219x100.png/5fa2dd/ffffff,false
129,Dazzlesphere,"Nullam porttitor lacus at turpis. Donec posuere metus vitae ipsum. Aliquam non mauris.

Morbi non lectus. Aliquam sit amet diam in magna bibendum imperdiet. Nullam orci pede, venenatis non, sodales sed, tincidunt eu, felis.",https://nifty.com/eros/vestibulum/ac/est/lacinia.json?orci=neque&nullam=vestibulum&molestie=eget&nibh=vulputate&in=ut&lectus=ultrices&pellentesque=vel&at=augue&nulla=vestibulum&suspendisse=ante&potenti=ipsum&cras=primis&in=in&purus=faucibus&eu=orci&magna=luctus&vulputate=et&luctus=ultrices&cum=posuere&sociis=cubilia&natoque=curae&penatibus=donec&et=pharetra&magnis=magna&dis=vestibulum&parturient=aliquet&montes=ultrices&nascetur=erat&ridiculus=tortor&mus=sollicitudin&vivamus=mi&vestibulum=sit&sagittis=amet&sapien=lobortis&cum=sapien&sociis=sapien&natoque=non&penatibus=mi&et=integer&magnis=ac&dis=neque&parturient=duis&montes=bibendum&nascetur=morbi&ridiculus=non&mus=quam&etiam=nec&vel=dui&augue=luctus&vestibulum=rutrum&rutrum=nulla&rutrum=tellus&neque=in&aenean=sagittis&auctor=dui&gravida=vel&sem=nisl&praesent=duis&id=ac&massa=nibh&id=fusce&nisl=lacus&venenatis=purus&lacinia=aliquet&aenean=at&sit=feugiat&amet=non&justo=pretium&morbi=quis&ut=lectus&odio=suspendisse&cras=potenti&mi=in&pede=eleifend&malesuada=quam&in=a&imperdiet=odio&et=in&commodo=hac&vulputate=habitasse,http://dummyimage.com/157x100.png/cc0000/ffffff,false
130,Quamba,"Morbi non lectus. Aliquam sit amet diam in magna bibendum imperdiet. Nullam orci pede, venenatis non, sodales sed, tincidunt eu, felis.

Fusce posuere felis sed lacus. Morbi sem mauris, laoreet ut, rhoncus aliquet, pulvinar sed, nisl. Nunc rhoncus dui vel sem.

Sed sagittis. Nam congue, risus semper porta volutpat, quam pede lobortis ligula, sit amet eleifend pede libero quis orci. Nullam molestie nibh in lectus.",http://tripadvisor.com/gravida.xml?lorem=massa&ipsum=tempor&dolor=convallis&sit=nulla&amet=neque&consectetuer=libero&adipiscing=convallis&elit=eget&proin=eleifend&risus=luctus&praesent=ultricies&lectus=eu&vestibulum=nibh&quam=quisque&sapien=id&varius=justo&ut=sit&blandit=amet&non=sapien&interdum=dignissim&in=vestibulum&ante=vestibulum,http://dummyimage.com/105x100.png/5fa2dd/ffffff,false
131,Yakijo,"Integer ac leo. Pellentesque ultrices mattis odio. Donec vitae nisi.

Nam ultrices, libero non mattis pulvinar, nulla pede ullamcorper augue, a suscipit nulla elit ac nulla. Sed vel enim sit amet nunc viverra dapibus. Nulla suscipit ligula in lacus.

Curabitur at ipsum ac tellus semper interdum. Mauris ullamcorper purus sit amet nulla. Quisque arcu libero, rutrum ac, lobortis vel, dapibus at, diam.",https://artisteer.com/integer/ac/leo/pellentesque/ultrices.json?dapibus=semper&nulla=est&suscipit=quam&ligula=pharetra,http://dummyimage.com/146x100.png/dddddd/000000,true
132,Skajo,"Curabitur in libero ut massa volutpat convallis. Morbi odio odio, elementum eu, interdum eu, tincidunt in, leo. Maecenas pulvinar lobortis est.",https://cisco.com/morbi/odio/odio/elementum/eu/interdum/eu.js?ut=maecenas&at=tristique&dolor=est&quis=et&odio=tempus&consequat=semper&varius=est&integer=quam&ac=pharetra&leo=magna&pellentesque=ac&ultrices=consequat&mattis=metus&odio=sapien&donec=ut&vitae=nunc&nisi=vestibulum,http://dummyimage.com/109x100.png/dddddd/000000,false
133,Jetpulse,"Phasellus in felis. Donec semper sapien a libero. Nam dui.

Proin leo odio, porttitor id, consequat in, consequat ut, nulla. Sed accumsan felis. Ut at dolor quis odio consequat varius.",http://mapquest.com/id/ligula/suspendisse/ornare.html?rutrum=dictumst&nulla=etiam&nunc=faucibus&purus=cursus&phasellus=urna&in=ut&felis=tellus&donec=nulla&semper=ut&sapien=erat&a=id&libero=mauris&nam=vulputate&dui=elementum&proin=nullam&leo=varius&odio=nulla&porttitor=facilisi&id=cras&consequat=non&in=velit&consequat=nec&ut=nisi&nulla=vulputate&sed=nonummy&accumsan=maecenas&felis=tincidunt&ut=lacus&at=at&dolor=velit&quis=vivamus&odio=vel&consequat=nulla&varius=eget&integer=eros&ac=elementum&leo=pellentesque&pellentesque=quisque&ultrices=porta&mattis=volutpat&odio=erat&donec=quisque&vitae=erat&nisi=eros&nam=viverra&ultrices=eget&libero=congue&non=eget&mattis=semper&pulvinar=rutrum&nulla=nulla&pede=nunc&ullamcorper=purus&augue=phasellus&a=in&suscipit=felis&nulla=donec&elit=semper&ac=sapien&nulla=a&sed=libero&vel=nam&enim=dui&sit=proin&amet=leo&nunc=odio&viverra=porttitor,http://dummyimage.com/204x100.png/ff4444/ffffff,true
134,Skiba,"Duis aliquam convallis nunc. Proin at turpis a pede posuere nonummy. Integer non velit.

Donec diam neque, vestibulum eget, vulputate ut, ultrices vel, augue. Vestibulum ante ipsum primis in faucibus orci luctus et ultrices posuere cubilia Curae; Donec pharetra, magna vestibulum aliquet ultrices, erat tortor sollicitudin mi, sit amet lobortis sapien sapien non mi. Integer ac neque.

Duis bibendum. Morbi non quam nec dui luctus rutrum. Nulla tellus.",http://sina.com.cn/risus/praesent/lectus/vestibulum/quam/sapien.js?nunc=ipsum&proin=primis&at=in&turpis=faucibus&a=orci&pede=luctus&posuere=et&nonummy=ultrices&integer=posuere&non=cubilia&velit=curae&donec=duis&diam=faucibus&neque=accumsan&vestibulum=odio&eget=curabitur&vulputate=convallis&ut=duis&ultrices=consequat&vel=dui&augue=nec&vestibulum=nisi&ante=volutpat&ipsum=eleifend&primis=donec&in=ut&faucibus=dolor&orci=morbi,http://dummyimage.com/181x100.png/ff4444/ffffff,true
135,Gabtype,Nullam porttitor lacus at turpis. Donec posuere metus vitae ipsum. Aliquam non mauris.,http://state.tx.us/morbi/ut/odio.png?justo=cras&nec=mi&condimentum=pede&neque=malesuada&sapien=in&placerat=imperdiet&ante=et&nulla=commodo&justo=vulputate&aliquam=justo&quis=in&turpis=blandit&eget=ultrices&elit=enim&sodales=lorem&scelerisque=ipsum&mauris=dolor&sit=sit&amet=amet&eros=consectetuer&suspendisse=adipiscing&accumsan=elit&tortor=proin&quis=interdum&turpis=mauris&sed=non&ante=ligula&vivamus=pellentesque&tortor=ultrices&duis=phasellus&mattis=id&egestas=sapien&metus=in&aenean=sapien&fermentum=iaculis&donec=congue&ut=vivamus&mauris=metus&eget=arcu&massa=adipiscing&tempor=molestie&convallis=hendrerit&nulla=at&neque=vulputate&libero=vitae&convallis=nisl&eget=aenean&eleifend=lectus&luctus=pellentesque&ultricies=eget&eu=nunc&nibh=donec&quisque=quis&id=orci&justo=eget&sit=orci&amet=vehicula&sapien=condimentum&dignissim=curabitur&vestibulum=in&vestibulum=libero&ante=ut&ipsum=massa&primis=volutpat&in=convallis&faucibus=morbi&orci=odio&luctus=odio&et=elementum&ultrices=eu&posuere=interdum&cubilia=eu&curae=tincidunt&nulla=in&dapibus=leo&dolor=maecenas&vel=pulvinar&est=lobortis&donec=est&odio=phasellus&justo=sit&sollicitudin=amet&ut=erat&suscipit=nulla&a=tempus&feugiat=vivamus&et=in&eros=felis&vestibulum=eu&ac=sapien&est=cursus&lacinia=vestibulum&nisi=proin&venenatis=eu&tristique=mi&fusce=nulla&congue=ac&diam=enim&id=in,http://dummyimage.com/203x100.png/5fa2dd/ffffff,true
136,Twiyo,"Donec diam neque, vestibulum eget, vulputate ut, ultrices vel, augue. Vestibulum ante ipsum primis in faucibus orci luctus et ultrices posuere cubilia Curae; Donec pharetra, magna vestibulum aliquet ultrices, erat tortor sollicitudin mi, sit amet lobortis sapien sapien non mi. Integer ac neque.

Duis bibendum. Morbi non quam nec dui luctus rutrum. Nulla tellus.",http://europa.eu/bibendum/felis/sed/interdum.png?primis=tristique&in=est&faucibus=et&orci=tempus&luctus=semper&et=est&ultrices=quam&posuere=pharetra&cubilia=magna&curae=ac&donec=consequat&pharetra=metus&magna=sapien&vestibulum=ut&aliquet=nunc&ultrices=vestibulum&erat=ante&tortor=ipsum&sollicitudin=primis&mi=in&sit=faucibus&amet=orci&lobortis=luctus&sapien=et&sapien=ultrices&non=posuere&mi=cubilia&integer=curae&ac=mauris&neque=viverra&duis=diam&bibendum=vitae&morbi=quam&non=suspendisse&quam=potenti&nec=nullam&dui=porttitor&luctus=lacus&rutrum=at&nulla=turpis&tellus=donec&in=posuere&sagittis=metus&dui=vitae&vel=ipsum&nisl=aliquam&duis=non&ac=mauris&nibh=morbi&fusce=non&lacus=lectus&purus=aliquam&aliquet=sit&at=amet&feugiat=diam&non=in&pretium=magna&quis=bibendum&lectus=imperdiet&suspendisse=nullam&potenti=orci&in=pede&eleifend=venenatis&quam=non&a=sodales&odio=sed&in=tincidunt&hac=eu&habitasse=felis&platea=fusce&dictumst=posuere&maecenas=felis&ut=sed&massa=lacus&quis=morbi&augue=sem&luctus=mauris&tincidunt=laoreet&nulla=ut&mollis=rhoncus&molestie=aliquet&lorem=pulvinar&quisque=sed&ut=nisl&erat=nunc&curabitur=rhoncus&gravida=dui&nisi=vel&at=sem&nibh=sed&in=sagittis&hac=nam&habitasse=congue&platea=risus&dictumst=semper&aliquam=porta&augue=volutpat&quam=quam,http://dummyimage.com/210x100.png/5fa2dd/ffffff,false
137,Shuffletag,"Nulla ut erat id mauris vulputate elementum. Nullam varius. Nulla facilisi.

Cras non velit nec nisi vulputate nonummy. Maecenas tincidunt lacus at velit. Vivamus vel nulla eget eros elementum pellentesque.

Quisque porta volutpat erat. Quisque erat eros, viverra eget, congue eget, semper rutrum, nulla. Nunc purus.",http://unicef.org/sapien/ut.js?a=convallis&nibh=tortor&in=risus&quis=dapibus&justo=augue&maecenas=vel&rhoncus=accumsan&aliquam=tellus&lacus=nisi&morbi=eu&quis=orci&tortor=mauris&id=lacinia&nulla=sapien&ultrices=quis&aliquet=libero&maecenas=nullam&leo=sit&odio=amet&condimentum=turpis&id=elementum&luctus=ligula&nec=vehicula&molestie=consequat&sed=morbi&justo=a&pellentesque=ipsum&viverra=integer&pede=a&ac=nibh&diam=in&cras=quis&pellentesque=justo&volutpat=maecenas&dui=rhoncus&maecenas=aliquam&tristique=lacus&est=morbi&et=quis&tempus=tortor&semper=id&est=nulla&quam=ultrices&pharetra=aliquet&magna=maecenas&ac=leo&consequat=odio&metus=condimentum&sapien=id&ut=luctus&nunc=nec&vestibulum=molestie&ante=sed&ipsum=justo&primis=pellentesque&in=viverra&faucibus=pede&orci=ac,http://dummyimage.com/195x100.png/5fa2dd/ffffff,false
138,Ozu,"In sagittis dui vel nisl. Duis ac nibh. Fusce lacus purus, aliquet at, feugiat non, pretium quis, lectus.

Suspendisse potenti. In eleifend quam a odio. In hac habitasse platea dictumst.

Maecenas ut massa quis augue luctus tincidunt. Nulla mollis molestie lorem. Quisque ut erat.",https://harvard.edu/aliquam/lacus/morbi/quis/tortor.html?ipsum=aenean&aliquam=sit&non=amet&mauris=justo&morbi=morbi&non=ut&lectus=odio&aliquam=cras&sit=mi&amet=pede&diam=malesuada&in=in&magna=imperdiet&bibendum=et&imperdiet=commodo&nullam=vulputate&orci=justo&pede=in&venenatis=blandit&non=ultrices&sodales=enim&sed=lorem&tincidunt=ipsum&eu=dolor&felis=sit&fusce=amet&posuere=consectetuer&felis=adipiscing&sed=elit&lacus=proin&morbi=interdum&sem=mauris&mauris=non&laoreet=ligula&ut=pellentesque,http://dummyimage.com/147x100.png/ff4444/ffffff,true
139,Browseblab,"Praesent blandit. Nam nulla. Integer pede justo, lacinia eget, tincidunt eget, tempus vel, pede.",http://multiply.com/condimentum/id/luctus/nec/molestie/sed.js?pulvinar=velit,http://dummyimage.com/173x100.png/5fa2dd/ffffff,false
140,Muxo,"Morbi porttitor lorem id ligula. Suspendisse ornare consequat lectus. In est risus, auctor sed, tristique in, tempus sit amet, sem.

Fusce consequat. Nulla nisl. Nunc nisl.

Duis bibendum, felis sed interdum venenatis, turpis enim blandit mi, in porttitor pede justo eu massa. Donec dapibus. Duis at velit eu est congue elementum.",https://prweb.com/mauris.html?ante=volutpat&nulla=quam&justo=pede&aliquam=lobortis&quis=ligula&turpis=sit&eget=amet&elit=eleifend&sodales=pede&scelerisque=libero&mauris=quis&sit=orci&amet=nullam&eros=molestie&suspendisse=nibh&accumsan=in&tortor=lectus&quis=pellentesque&turpis=at&sed=nulla&ante=suspendisse&vivamus=potenti&tortor=cras&duis=in&mattis=purus&egestas=eu&metus=magna&aenean=vulputate&fermentum=luctus&donec=cum&ut=sociis&mauris=natoque&eget=penatibus&massa=et&tempor=magnis&convallis=dis&nulla=parturient&neque=montes&libero=nascetur&convallis=ridiculus&eget=mus&eleifend=vivamus&luctus=vestibulum&ultricies=sagittis&eu=sapien&nibh=cum&quisque=sociis&id=natoque&justo=penatibus&sit=et&amet=magnis&sapien=dis&dignissim=parturient&vestibulum=montes&vestibulum=nascetur&ante=ridiculus&ipsum=mus&primis=etiam&in=vel&faucibus=augue&orci=vestibulum&luctus=rutrum&et=rutrum&ultrices=neque&posuere=aenean&cubilia=auctor&curae=gravida&nulla=sem&dapibus=praesent&dolor=id&vel=massa&est=id&donec=nisl&odio=venenatis&justo=lacinia&sollicitudin=aenean&ut=sit&suscipit=amet&a=justo&feugiat=morbi,http://dummyimage.com/119x100.png/cc0000/ffffff,true
141,Thoughtworks,Sed ante. Vivamus tortor. Duis mattis egestas metus.,http://bandcamp.com/ut/massa/quis/augue.json?lobortis=nam&ligula=dui&sit=proin&amet=leo&eleifend=odio&pede=porttitor&libero=id&quis=consequat&orci=in&nullam=consequat&molestie=ut&nibh=nulla&in=sed&lectus=accumsan&pellentesque=felis&at=ut&nulla=at&suspendisse=dolor&potenti=quis&cras=odio&in=consequat&purus=varius&eu=integer&magna=ac&vulputate=leo&luctus=pellentesque&cum=ultrices&sociis=mattis&natoque=odio&penatibus=donec&et=vitae&magnis=nisi&dis=nam&parturient=ultrices&montes=libero&nascetur=non&ridiculus=mattis&mus=pulvinar&vivamus=nulla&vestibulum=pede,http://dummyimage.com/115x100.png/5fa2dd/ffffff,false
142,Blogtag,"Proin interdum mauris non ligula pellentesque ultrices. Phasellus id sapien in sapien iaculis congue. Vivamus metus arcu, adipiscing molestie, hendrerit at, vulputate vitae, nisl.",https://msu.edu/quis.json?in=luctus&faucibus=et&orci=ultrices&luctus=posuere&et=cubilia&ultrices=curae&posuere=duis&cubilia=faucibus&curae=accumsan&donec=odio&pharetra=curabitur&magna=convallis&vestibulum=duis&aliquet=consequat&ultrices=dui&erat=nec&tortor=nisi&sollicitudin=volutpat&mi=eleifend&sit=donec&amet=ut&lobortis=dolor&sapien=morbi&sapien=vel&non=lectus&mi=in&integer=quam&ac=fringilla&neque=rhoncus&duis=mauris&bibendum=enim&morbi=leo&non=rhoncus&quam=sed&nec=vestibulum&dui=sit&luctus=amet&rutrum=cursus&nulla=id&tellus=turpis&in=integer&sagittis=aliquet&dui=massa&vel=id&nisl=lobortis&duis=convallis&ac=tortor&nibh=risus,http://dummyimage.com/161x100.png/5fa2dd/ffffff,false
143,Photofeed,"In congue. Etiam justo. Etiam pretium iaculis justo.

In hac habitasse platea dictumst. Etiam faucibus cursus urna. Ut tellus.

Nulla ut erat id mauris vulputate elementum. Nullam varius. Nulla facilisi.",http://mozilla.org/velit/id/pretium.png?nisi=curae&eu=mauris&orci=viverra&mauris=diam&lacinia=vitae&sapien=quam&quis=suspendisse&libero=potenti&nullam=nullam&sit=porttitor&amet=lacus&turpis=at&elementum=turpis&ligula=donec&vehicula=posuere&consequat=metus&morbi=vitae&a=ipsum&ipsum=aliquam&integer=non&a=mauris&nibh=morbi&in=non&quis=lectus&justo=aliquam&maecenas=sit&rhoncus=amet&aliquam=diam&lacus=in&morbi=magna&quis=bibendum&tortor=imperdiet,http://dummyimage.com/104x100.png/5fa2dd/ffffff,false
144,Zoomcast,"Integer ac leo. Pellentesque ultrices mattis odio. Donec vitae nisi.

Nam ultrices, libero non mattis pulvinar, nulla pede ullamcorper augue, a suscipit nulla elit ac nulla. Sed vel enim sit amet nunc viverra dapibus. Nulla suscipit ligula in lacus.",http://gmpg.org/a/libero/nam/dui/proin.xml?morbi=nulla&vel=ultrices,http://dummyimage.com/249x100.png/dddddd/000000,true
145,Skipstorm,"Maecenas tristique, est et tempus semper, est quam pharetra magna, ac consequat metus sapien ut nunc. Vestibulum ante ipsum primis in faucibus orci luctus et ultrices posuere cubilia Curae; Mauris viverra diam vitae quam. Suspendisse potenti.

Nullam porttitor lacus at turpis. Donec posuere metus vitae ipsum. Aliquam non mauris.",http://boston.com/in/hac/habitasse/platea/dictumst/etiam.js?in=a&faucibus=nibh&orci=in&luctus=quis&et=justo&ultrices=maecenas&posuere=rhoncus&cubilia=aliquam&curae=lacus&nulla=morbi&dapibus=quis&dolor=tortor&vel=id&est=nulla&donec=ultrices&odio=aliquet&justo=maecenas&sollicitudin=leo&ut=odio&suscipit=condimentum&a=id&feugiat=luctus&et=nec&eros=molestie&vestibulum=sed&ac=justo&est=pellentesque&lacinia=viverra&nisi=pede&venenatis=ac&tristique=diam&fusce=cras&congue=pellentesque&diam=volutpat&id=dui&ornare=maecenas&imperdiet=tristique&sapien=est&urna=et&pretium=tempus&nisl=semper&ut=est&volutpat=quam&sapien=pharetra&arcu=magna&sed=ac&augue=consequat&aliquam=metus&erat=sapien&volutpat=ut&in=nunc&congue=vestibulum&etiam=ante&justo=ipsum&etiam=primis&pretium=in&iaculis=faucibus&justo=orci&in=luctus&hac=et&habitasse=ultrices&platea=posuere&dictumst=cubilia&etiam=curae&faucibus=mauris&cursus=viverra&urna=diam&ut=vitae&tellus=quam&nulla=suspendisse,http://dummyimage.com/102x100.png/cc0000/ffffff,false
146,Quinu,"Curabitur at ipsum ac tellus semper interdum. Mauris ullamcorper purus sit amet nulla. Quisque arcu libero, rutrum ac, lobortis vel, dapibus at, diam.",http://delicious.com/platea/dictumst.aspx?odio=porttitor&porttitor=id&id=consequat&consequat=in&in=consequat,http://dummyimage.com/157x100.png/ff4444/ffffff,true
147,Tagchat,"In hac habitasse platea dictumst. Morbi vestibulum, velit id pretium iaculis, diam erat fermentum justo, nec condimentum neque sapien placerat ante. Nulla justo.

Aliquam quis turpis eget elit sodales scelerisque. Mauris sit amet eros. Suspendisse accumsan tortor quis turpis.",http://livejournal.com/dolor/morbi/vel/lectus/in/quam/fringilla.js?non=pede&sodales=morbi&sed=porttitor&tincidunt=lorem&eu=id&felis=ligula&fusce=suspendisse&posuere=ornare&felis=consequat&sed=lectus&lacus=in&morbi=est&sem=risus&mauris=auctor&laoreet=sed&ut=tristique&rhoncus=in&aliquet=tempus&pulvinar=sit&sed=amet&nisl=sem&nunc=fusce&rhoncus=consequat&dui=nulla&vel=nisl&sem=nunc&sed=nisl,http://dummyimage.com/223x100.png/ff4444/ffffff,false
148,Edgepulse,"Integer ac leo. Pellentesque ultrices mattis odio. Donec vitae nisi.

Nam ultrices, libero non mattis pulvinar, nulla pede ullamcorper augue, a suscipit nulla elit ac nulla. Sed vel enim sit amet nunc viverra dapibus. Nulla suscipit ligula in lacus.",https://samsung.com/viverra/diam/vitae/quam/suspendisse.jpg?in=ut&congue=massa&etiam=volutpat&justo=convallis&etiam=morbi&pretium=odio&iaculis=odio&justo=elementum&in=eu&hac=interdum&habitasse=eu&platea=tincidunt&dictumst=in&etiam=leo&faucibus=maecenas&cursus=pulvinar&urna=lobortis&ut=est&tellus=phasellus&nulla=sit&ut=amet&erat=erat&id=nulla&mauris=tempus&vulputate=vivamus&elementum=in&nullam=felis&varius=eu&nulla=sapien&facilisi=cursus&cras=vestibulum&non=proin&velit=eu&nec=mi&nisi=nulla&vulputate=ac&nonummy=enim&maecenas=in&tincidunt=tempor&lacus=turpis&at=nec&velit=euismod&vivamus=scelerisque&vel=quam&nulla=turpis&eget=adipiscing&eros=lorem&elementum=vitae&pellentesque=mattis&quisque=nibh&porta=ligula&volutpat=nec&erat=sem&quisque=duis&erat=aliquam&eros=convallis&viverra=nunc&eget=proin&congue=at&eget=turpis&semper=a&rutrum=pede&nulla=posuere&nunc=nonummy&purus=integer&phasellus=non&in=velit&felis=donec&donec=diam&semper=neque&sapien=vestibulum&a=eget&libero=vulputate&nam=ut&dui=ultrices&proin=vel,http://dummyimage.com/160x100.png/5fa2dd/ffffff,true
149,Feedmix,"Quisque id justo sit amet sapien dignissim vestibulum. Vestibulum ante ipsum primis in faucibus orci luctus et ultrices posuere cubilia Curae; Nulla dapibus dolor vel est. Donec odio justo, sollicitudin ut, suscipit a, feugiat et, eros.",https://apache.org/pellentesque/ultrices/mattis/odio/donec.js?primis=amet&in=consectetuer&faucibus=adipiscing&orci=elit&luctus=proin&et=risus&ultrices=praesent&posuere=lectus&cubilia=vestibulum&curae=quam&nulla=sapien&dapibus=varius,http://dummyimage.com/112x100.png/ff4444/ffffff,false
150,Tazzy,"Aenean lectus. Pellentesque eget nunc. Donec quis orci eget orci vehicula condimentum.

Curabitur in libero ut massa volutpat convallis. Morbi odio odio, elementum eu, interdum eu, tincidunt in, leo. Maecenas pulvinar lobortis est.",https://oakley.com/non.html?habitasse=in&platea=congue&dictumst=etiam&aliquam=justo&augue=etiam&quam=pretium&sollicitudin=iaculis&vitae=justo&consectetuer=in&eget=hac&rutrum=habitasse&at=platea&lorem=dictumst&integer=etiam&tincidunt=faucibus&ante=cursus&vel=urna&ipsum=ut&praesent=tellus&blandit=nulla&lacinia=ut&erat=erat&vestibulum=id&sed=mauris&magna=vulputate&at=elementum&nunc=nullam&commodo=varius&placerat=nulla&praesent=facilisi&blandit=cras&nam=non&nulla=velit&integer=nec&pede=nisi&justo=vulputate&lacinia=nonummy&eget=maecenas&tincidunt=tincidunt&eget=lacus&tempus=at&vel=velit&pede=vivamus&morbi=vel&porttitor=nulla&lorem=eget&id=eros&ligula=elementum&suspendisse=pellentesque&ornare=quisque&consequat=porta&lectus=volutpat&in=erat&est=quisque&risus=erat&auctor=eros&sed=viverra&tristique=eget&in=congue&tempus=eget&sit=semper&amet=rutrum,http://dummyimage.com/102x100.png/dddddd/000000,false
151,Eidel,"Duis bibendum. Morbi non quam nec dui luctus rutrum. Nulla tellus.

In sagittis dui vel nisl. Duis ac nibh. Fusce lacus purus, aliquet at, feugiat non, pretium quis, lectus.

Suspendisse potenti. In eleifend quam a odio. In hac habitasse platea dictumst.",https://baidu.com/convallis/nulla/neque.js?morbi=quam&vel=pharetra&lectus=magna&in=ac&quam=consequat&fringilla=metus&rhoncus=sapien&mauris=ut&enim=nunc&leo=vestibulum&rhoncus=ante&sed=ipsum&vestibulum=primis&sit=in&amet=faucibus&cursus=orci&id=luctus&turpis=et&integer=ultrices&aliquet=posuere&massa=cubilia&id=curae&lobortis=mauris&convallis=viverra&tortor=diam&risus=vitae&dapibus=quam&augue=suspendisse&vel=potenti&accumsan=nullam&tellus=porttitor&nisi=lacus&eu=at&orci=turpis&mauris=donec&lacinia=posuere&sapien=metus&quis=vitae&libero=ipsum&nullam=aliquam&sit=non&amet=mauris&turpis=morbi&elementum=non&ligula=lectus&vehicula=aliquam&consequat=sit&morbi=amet&a=diam&ipsum=in&integer=magna&a=bibendum&nibh=imperdiet&in=nullam&quis=orci&justo=pede&maecenas=venenatis&rhoncus=non&aliquam=sodales&lacus=sed&morbi=tincidunt&quis=eu&tortor=felis&id=fusce&nulla=posuere&ultrices=felis&aliquet=sed&maecenas=lacus&leo=morbi&odio=sem&condimentum=mauris&id=laoreet&luctus=ut&nec=rhoncus&molestie=aliquet&sed=pulvinar&justo=sed&pellentesque=nisl&viverra=nunc&pede=rhoncus&ac=dui&diam=vel&cras=sem,http://dummyimage.com/113x100.png/5fa2dd/ffffff,false
152,Quatz,"Duis aliquam convallis nunc. Proin at turpis a pede posuere nonummy. Integer non velit.

Donec diam neque, vestibulum eget, vulputate ut, ultrices vel, augue. Vestibulum ante ipsum primis in faucibus orci luctus et ultrices posuere cubilia Curae; Donec pharetra, magna vestibulum aliquet ultrices, erat tortor sollicitudin mi, sit amet lobortis sapien sapien non mi. Integer ac neque.",https://imageshack.us/ac/neque/duis/bibendum.png?in=nullam&imperdiet=porttitor&et=lacus&commodo=at&vulputate=turpis&justo=donec&in=posuere&blandit=metus&ultrices=vitae&enim=ipsum&lorem=aliquam&ipsum=non&dolor=mauris&sit=morbi&amet=non&consectetuer=lectus&adipiscing=aliquam&elit=sit&proin=amet&interdum=diam&mauris=in&non=magna&ligula=bibendum&pellentesque=imperdiet&ultrices=nullam&phasellus=orci&id=pede&sapien=venenatis&in=non&sapien=sodales&iaculis=sed&congue=tincidunt&vivamus=eu&metus=felis&arcu=fusce&adipiscing=posuere&molestie=felis&hendrerit=sed&at=lacus&vulputate=morbi&vitae=sem&nisl=mauris&aenean=laoreet&lectus=ut&pellentesque=rhoncus&eget=aliquet&nunc=pulvinar&donec=sed&quis=nisl&orci=nunc&eget=rhoncus&orci=dui&vehicula=vel&condimentum=sem&curabitur=sed&in=sagittis&libero=nam&ut=congue&massa=risus&volutpat=semper&convallis=porta,http://dummyimage.com/196x100.png/5fa2dd/ffffff,false
153,Trudoo,"Nullam porttitor lacus at turpis. Donec posuere metus vitae ipsum. Aliquam non mauris.

Morbi non lectus. Aliquam sit amet diam in magna bibendum imperdiet. Nullam orci pede, venenatis non, sodales sed, tincidunt eu, felis.

Fusce posuere felis sed lacus. Morbi sem mauris, laoreet ut, rhoncus aliquet, pulvinar sed, nisl. Nunc rhoncus dui vel sem.",https://w3.org/venenatis/non/sodales/sed.aspx?aliquam=etiam&lacus=vel&morbi=augue&quis=vestibulum&tortor=rutrum&id=rutrum&nulla=neque&ultrices=aenean&aliquet=auctor&maecenas=gravida&leo=sem&odio=praesent&condimentum=id&id=massa&luctus=id&nec=nisl&molestie=venenatis&sed=lacinia&justo=aenean&pellentesque=sit&viverra=amet&pede=justo&ac=morbi&diam=ut&cras=odio&pellentesque=cras&volutpat=mi&dui=pede&maecenas=malesuada&tristique=in&est=imperdiet&et=et&tempus=commodo&semper=vulputate&est=justo&quam=in&pharetra=blandit&magna=ultrices&ac=enim&consequat=lorem&metus=ipsum&sapien=dolor&ut=sit&nunc=amet&vestibulum=consectetuer&ante=adipiscing&ipsum=elit&primis=proin&in=interdum&faucibus=mauris&orci=non&luctus=ligula&et=pellentesque&ultrices=ultrices&posuere=phasellus&cubilia=id&curae=sapien&mauris=in,http://dummyimage.com/206x100.png/5fa2dd/ffffff,true
