firm_id,firm_name,description_firm,website,logo,inactif
47,Cogibox,"Maecenas leo odio, condimentum id, luctus nec, molestie sed, justo. Pellentesque viverra pede ac diam. Cras pellentesque volutpat dui.",https://unc.edu/id/justo/sit/amet/sapien.jpg?hac=cubilia&habitasse=curae&platea=mauris&dictumst=viverra&morbi=diam&vestibulum=vitae&velit=quam&id=suspendisse&pretium=potenti&iaculis=nullam&diam=porttitor&erat=lacus&fermentum=at&justo=turpis&nec=donec&condimentum=posuere&neque=metus&sapien=vitae&placerat=ipsum&ante=aliquam&nulla=non&justo=mauris&aliquam=morbi&quis=non&turpis=lectus&eget=aliquam&elit=sit&sodales=amet&scelerisque=diam&mauris=in&sit=magna&amet=bibendum&eros=imperdiet&suspendisse=nullam&accumsan=orci&tortor=pede&quis=venenatis&turpis=non&sed=sodales&ante=sed&vivamus=tincidunt&tortor=eu&duis=felis&mattis=fusce&egestas=posuere&metus=felis&aenean=sed&fermentum=lacus&donec=morbi&ut=sem&mauris=mauris&eget=laoreet&massa=ut&tempor=rhoncus&convallis=aliquet&nulla=pulvinar&neque=sed&libero=nisl&convallis=nunc&eget=rhoncus&eleifend=dui&luctus=vel&ultricies=sem&eu=sed&nibh=sagittis&quisque=nam&id=congue&justo=risus&sit=semper&amet=porta&sapien=volutpat&dignissim=quam&vestibulum=pede&vestibulum=lobortis&ante=ligula&ipsum=sit&primis=amet&in=eleifend&faucibus=pede&orci=libero&luctus=quis&et=orci,http://dummyimage.com/138x100.png/5fa2dd/ffffff,false
48,Zoomzone,"Etiam vel augue. Vestibulum rutrum rutrum neque. Aenean auctor gravida sem.

Praesent id massa id nisl venenatis lacinia. Aenean sit amet justo. Morbi ut odio.

Cras mi pede, malesuada in, imperdiet et, commodo vulputate, justo. In blandit ultrices enim. Lorem ipsum dolor sit amet, consectetuer adipiscing elit.",http://ucla.edu/vestibulum/sed/magna/at/nunc/commodo.js?phasellus=sapien&id=sapien&sapien=non&in=mi&sapien=integer&iaculis=ac&congue=neque&vivamus=duis&metus=bibendum&arcu=morbi&adipiscing=non&molestie=quam&hendrerit=nec&at=dui&vulputate=luctus&vitae=rutrum&nisl=nulla&aenean=tellus&lectus=in&pellentesque=sagittis&eget=dui&nunc=vel&donec=nisl&quis=duis&orci=ac&eget=nibh&orci=fusce&vehicula=lacus&condimentum=purus&curabitur=aliquet&in=at&libero=feugiat&ut=non&massa=pretium&volutpat=quis&convallis=lectus&morbi=suspendisse&odio=potenti&odio=in&elementum=eleifend&eu=quam&interdum=a&eu=odio&tincidunt=in&in=hac&leo=habitasse&maecenas=platea&pulvinar=dictumst&lobortis=maecenas&est=ut&phasellus=massa&sit=quis&amet=augue&erat=luctus&nulla=tincidunt&tempus=nulla&vivamus=mollis&in=molestie&felis=lorem&eu=quisque&sapien=ut&cursus=erat&vestibulum=curabitur&proin=gravida&eu=nisi&mi=at&nulla=nibh&ac=in&enim=hac&in=habitasse&tempor=platea&turpis=dictumst&nec=aliquam&euismod=augue&scelerisque=quam&quam=sollicitudin&turpis=vitae&adipiscing=consectetuer&lorem=eget&vitae=rutrum&mattis=at&nibh=lorem&ligula=integer&nec=tincidunt&sem=ante&duis=vel&aliquam=ipsum&convallis=praesent&nunc=blandit&proin=lacinia,http://dummyimage.com/142x100.png/dddddd/000000,false
49,Eare,"In sagittis dui vel nisl. Duis ac nibh. Fusce lacus purus, aliquet at, feugiat non, pretium quis, lectus.",http://bluehost.com/donec/ut/dolor/morbi/vel/lectus/in.html?volutpat=lorem&dui=integer&maecenas=tincidunt&tristique=ante&est=vel&et=ipsum&tempus=praesent&semper=blandit&est=lacinia&quam=erat&pharetra=vestibulum&magna=sed&ac=magna&consequat=at&metus=nunc&sapien=commodo&ut=placerat&nunc=praesent&vestibulum=blandit&ante=nam&ipsum=nulla&primis=integer&in=pede&faucibus=justo&orci=lacinia&luctus=eget&et=tincidunt&ultrices=eget&posuere=tempus&cubilia=vel&curae=pede&mauris=morbi&viverra=porttitor&diam=lorem&vitae=id&quam=ligula&suspendisse=suspendisse&potenti=ornare&nullam=consequat&porttitor=lectus&lacus=in&at=est&turpis=risus&donec=auctor&posuere=sed&metus=tristique&vitae=in&ipsum=tempus&aliquam=sit&non=amet&mauris=sem&morbi=fusce&non=consequat&lectus=nulla&aliquam=nisl&sit=nunc&amet=nisl&diam=duis&in=bibendum&magna=felis&bibendum=sed&imperdiet=interdum,http://dummyimage.com/124x100.png/ff4444/ffffff,false
50,Skyndu,"In sagittis dui vel nisl. Duis ac nibh. Fusce lacus purus, aliquet at, feugiat non, pretium quis, lectus.

Suspendisse potenti. In eleifend quam a odio. In hac habitasse platea dictumst.

Maecenas ut massa quis augue luctus tincidunt. Nulla mollis molestie lorem. Quisque ut erat.",http://businessinsider.com/sapien/iaculis/congue/vivamus/metus/arcu/adipiscing.js?felis=tristique&sed=in&interdum=tempus&venenatis=sit&turpis=amet&enim=sem&blandit=fusce&mi=consequat&in=nulla&porttitor=nisl&pede=nunc&justo=nisl&eu=duis&massa=bibendum&donec=felis&dapibus=sed&duis=interdum&at=venenatis&velit=turpis&eu=enim&est=blandit&congue=mi&elementum=in&in=porttitor&hac=pede&habitasse=justo&platea=eu&dictumst=massa&morbi=donec&vestibulum=dapibus&velit=duis&id=at&pretium=velit&iaculis=eu&diam=est&erat=congue&fermentum=elementum&justo=in&nec=hac&condimentum=habitasse&neque=platea&sapien=dictumst&placerat=morbi,http://dummyimage.com/213x100.png/cc0000/ffffff,true
51,Eazzy,"Mauris enim leo, rhoncus sed, vestibulum sit amet, cursus id, turpis. Integer aliquet, massa id lobortis convallis, tortor risus dapibus augue, vel accumsan tellus nisi eu orci. Mauris lacinia sapien quis libero.",http://paginegialle.it/id/nulla.png?ultrices=nam&aliquet=nulla&maecenas=integer&leo=pede&odio=justo&condimentum=lacinia,http://dummyimage.com/228x100.png/cc0000/ffffff,false
52,Reallinks,"Morbi porttitor lorem id ligula. Suspendisse ornare consequat lectus. In est risus, auctor sed, tristique in, tempus sit amet, sem.

Fusce consequat. Nulla nisl. Nunc nisl.",https://quantcast.com/nam/tristique/tortor/eu.png?ut=semper&rhoncus=rutrum&aliquet=nulla&pulvinar=nunc&sed=purus&nisl=phasellus&nunc=in&rhoncus=felis&dui=donec&vel=semper&sem=sapien&sed=a&sagittis=libero&nam=nam&congue=dui&risus=proin&semper=leo&porta=odio&volutpat=porttitor&quam=id&pede=consequat&lobortis=in&ligula=consequat&sit=ut&amet=nulla&eleifend=sed&pede=accumsan&libero=felis&quis=ut&orci=at&nullam=dolor&molestie=quis&nibh=odio&in=consequat&lectus=varius&pellentesque=integer&at=ac&nulla=leo&suspendisse=pellentesque&potenti=ultrices&cras=mattis&in=odio&purus=donec&eu=vitae&magna=nisi&vulputate=nam&luctus=ultrices&cum=libero&sociis=non&natoque=mattis&penatibus=pulvinar&et=nulla&magnis=pede&dis=ullamcorper&parturient=augue&montes=a&nascetur=suscipit&ridiculus=nulla&mus=elit&vivamus=ac&vestibulum=nulla&sagittis=sed&sapien=vel&cum=enim&sociis=sit&natoque=amet&penatibus=nunc&et=viverra&magnis=dapibus&dis=nulla&parturient=suscipit&montes=ligula&nascetur=in&ridiculus=lacus&mus=curabitur&etiam=at&vel=ipsum&augue=ac&vestibulum=tellus&rutrum=semper&rutrum=interdum&neque=mauris&aenean=ullamcorper&auctor=purus&gravida=sit&sem=amet&praesent=nulla&id=quisque&massa=arcu&id=libero&nisl=rutrum&venenatis=ac,http://dummyimage.com/167x100.png/dddddd/000000,false
53,Tazzy,"Maecenas tristique, est et tempus semper, est quam pharetra magna, ac consequat metus sapien ut nunc. Vestibulum ante ipsum primis in faucibus orci luctus et ultrices posuere cubilia Curae; Mauris viverra diam vitae quam. Suspendisse potenti.

Nullam porttitor lacus at turpis. Donec posuere metus vitae ipsum. Aliquam non mauris.

Morbi non lectus. Aliquam sit amet diam in magna bibendum imperdiet. Nullam orci pede, venenatis non, sodales sed, tincidunt eu, felis.",https://domainmarket.com/nunc/purus/phasellus.jsp?ultrices=mus&mattis=vivamus&odio=vestibulum&donec=sagittis,http://dummyimage.com/243x100.png/cc0000/ffffff,false
54,Devcast,"Proin eu mi. Nulla ac enim. In tempor, turpis nec euismod scelerisque, quam turpis adipiscing lorem, vitae mattis nibh ligula nec sem.",https://usgs.gov/curae/donec.json?in=donec&tempus=ut&sit=dolor&amet=morbi&sem=vel&fusce=lectus&consequat=in&nulla=quam&nisl=fringilla&nunc=rhoncus&nisl=mauris&duis=enim&bibendum=leo&felis=rhoncus&sed=sed&interdum=vestibulum&venenatis=sit&turpis=amet&enim=cursus&blandit=id&mi=turpis&in=integer&porttitor=aliquet&pede=massa&justo=id&eu=lobortis&massa=convallis&donec=tortor&dapibus=risus&duis=dapibus&at=augue&velit=vel&eu=accumsan&est=tellus&congue=nisi&elementum=eu&in=orci&hac=mauris&habitasse=lacinia&platea=sapien&dictumst=quis&morbi=libero&vestibulum=nullam&velit=sit&id=amet&pretium=turpis&iaculis=elementum&diam=ligula&erat=vehicula&fermentum=consequat&justo=morbi&nec=a&condimentum=ipsum&neque=integer&sapien=a&placerat=nibh&ante=in&nulla=quis&justo=justo&aliquam=maecenas&quis=rhoncus&turpis=aliquam&eget=lacus,http://dummyimage.com/161x100.png/5fa2dd/ffffff,true
55,Zoonder,"In sagittis dui vel nisl. Duis ac nibh. Fusce lacus purus, aliquet at, feugiat non, pretium quis, lectus.

Suspendisse potenti. In eleifend quam a odio. In hac habitasse platea dictumst.",http://cnbc.com/pellentesque/ultrices.xml?ut=turpis&nunc=sed&vestibulum=ante&ante=vivamus&ipsum=tortor&primis=duis&in=mattis&faucibus=egestas&orci=metus&luctus=aenean&et=fermentum&ultrices=donec&posuere=ut&cubilia=mauris&curae=eget&mauris=massa&viverra=tempor&diam=convallis&vitae=nulla&quam=neque&suspendisse=libero&potenti=convallis&nullam=eget&porttitor=eleifend&lacus=luctus&at=ultricies&turpis=eu&donec=nibh&posuere=quisque&metus=id&vitae=justo&ipsum=sit&aliquam=amet&non=sapien&mauris=dignissim&morbi=vestibulum&non=vestibulum&lectus=ante&aliquam=ipsum&sit=primis&amet=in&diam=faucibus&in=orci&magna=luctus&bibendum=et&imperdiet=ultrices&nullam=posuere&orci=cubilia&pede=curae&venenatis=nulla&non=dapibus&sodales=dolor&sed=vel&tincidunt=est&eu=donec&felis=odio&fusce=justo&posuere=sollicitudin&felis=ut&sed=suscipit&lacus=a&morbi=feugiat&sem=et&mauris=eros&laoreet=vestibulum&ut=ac&rhoncus=est&aliquet=lacinia&pulvinar=nisi&sed=venenatis&nisl=tristique&nunc=fusce&rhoncus=congue&dui=diam&vel=id&sem=ornare&sed=imperdiet&sagittis=sapien&nam=urna&congue=pretium,http://dummyimage.com/117x100.png/dddddd/000000,false
56,Bubbletube,"Sed ante. Vivamus tortor. Duis mattis egestas metus.

Aenean fermentum. Donec ut mauris eget massa tempor convallis. Nulla neque libero, convallis eget, eleifend luctus, ultricies eu, nibh.",http://wordpress.org/vivamus/vestibulum/sagittis/sapien.jpg?orci=mauris&nullam=enim&molestie=leo&nibh=rhoncus&in=sed&lectus=vestibulum&pellentesque=sit&at=amet&nulla=cursus&suspendisse=id&potenti=turpis&cras=integer&in=aliquet&purus=massa&eu=id&magna=lobortis&vulputate=convallis&luctus=tortor&cum=risus&sociis=dapibus&natoque=augue&penatibus=vel&et=accumsan&magnis=tellus&dis=nisi&parturient=eu&montes=orci&nascetur=mauris&ridiculus=lacinia&mus=sapien&vivamus=quis&vestibulum=libero&sagittis=nullam&sapien=sit&cum=amet&sociis=turpis&natoque=elementum&penatibus=ligula&et=vehicula&magnis=consequat&dis=morbi,http://dummyimage.com/104x100.png/ff4444/ffffff,true
57,Zoonder,"Morbi non lectus. Aliquam sit amet diam in magna bibendum imperdiet. Nullam orci pede, venenatis non, sodales sed, tincidunt eu, felis.

Fusce posuere felis sed lacus. Morbi sem mauris, laoreet ut, rhoncus aliquet, pulvinar sed, nisl. Nunc rhoncus dui vel sem.

Sed sagittis. Nam congue, risus semper porta volutpat, quam pede lobortis ligula, sit amet eleifend pede libero quis orci. Nullam molestie nibh in lectus.",https://ibm.com/eget/massa.xml?eget=amet&vulputate=sapien&ut=dignissim&ultrices=vestibulum&vel=vestibulum&augue=ante&vestibulum=ipsum&ante=primis&ipsum=in&primis=faucibus,http://dummyimage.com/211x100.png/ff4444/ffffff,false
58,Youopia,"Maecenas tristique, est et tempus semper, est quam pharetra magna, ac consequat metus sapien ut nunc. Vestibulum ante ipsum primis in faucibus orci luctus et ultrices posuere cubilia Curae; Mauris viverra diam vitae quam. Suspendisse potenti.",https://cisco.com/vestibulum/sagittis.js?duis=morbi&at=sem&velit=mauris&eu=laoreet&est=ut&congue=rhoncus&elementum=aliquet&in=pulvinar&hac=sed&habitasse=nisl&platea=nunc&dictumst=rhoncus&morbi=dui&vestibulum=vel&velit=sem&id=sed&pretium=sagittis&iaculis=nam&diam=congue&erat=risus&fermentum=semper&justo=porta&nec=volutpat&condimentum=quam&neque=pede&sapien=lobortis&placerat=ligula&ante=sit&nulla=amet&justo=eleifend&aliquam=pede&quis=libero&turpis=quis&eget=orci&elit=nullam&sodales=molestie&scelerisque=nibh&mauris=in&sit=lectus&amet=pellentesque&eros=at&suspendisse=nulla&accumsan=suspendisse&tortor=potenti&quis=cras&turpis=in&sed=purus&ante=eu&vivamus=magna&tortor=vulputate&duis=luctus,http://dummyimage.com/145x100.png/5fa2dd/ffffff,true
59,Kaymbo,"Aenean fermentum. Donec ut mauris eget massa tempor convallis. Nulla neque libero, convallis eget, eleifend luctus, ultricies eu, nibh.

Quisque id justo sit amet sapien dignissim vestibulum. Vestibulum ante ipsum primis in faucibus orci luctus et ultrices posuere cubilia Curae; Nulla dapibus dolor vel est. Donec odio justo, sollicitudin ut, suscipit a, feugiat et, eros.

Vestibulum ac est lacinia nisi venenatis tristique. Fusce congue, diam id ornare imperdiet, sapien urna pretium nisl, ut volutpat sapien arcu sed augue. Aliquam erat volutpat.",https://altervista.org/augue.jsp?neque=gravida&duis=sem&bibendum=praesent&morbi=id&non=massa&quam=id&nec=nisl&dui=venenatis&luctus=lacinia&rutrum=aenean&nulla=sit&tellus=amet&in=justo&sagittis=morbi&dui=ut&vel=odio&nisl=cras&duis=mi&ac=pede&nibh=malesuada,http://dummyimage.com/192x100.png/cc0000/ffffff,false
60,Zoomcast,"Cum sociis natoque penatibus et magnis dis parturient montes, nascetur ridiculus mus. Vivamus vestibulum sagittis sapien. Cum sociis natoque penatibus et magnis dis parturient montes, nascetur ridiculus mus.",https://sfgate.com/at/nibh/in/hac/habitasse/platea.jpg?posuere=faucibus&nonummy=orci&integer=luctus&non=et&velit=ultrices&donec=posuere&diam=cubilia&neque=curae&vestibulum=nulla&eget=dapibus&vulputate=dolor&ut=vel&ultrices=est&vel=donec&augue=odio&vestibulum=justo&ante=sollicitudin&ipsum=ut&primis=suscipit&in=a&faucibus=feugiat&orci=et&luctus=eros&et=vestibulum&ultrices=ac&posuere=est&cubilia=lacinia&curae=nisi&donec=venenatis&pharetra=tristique&magna=fusce,http://dummyimage.com/181x100.png/5fa2dd/ffffff,false
61,Jabbertype,"Curabitur in libero ut massa volutpat convallis. Morbi odio odio, elementum eu, interdum eu, tincidunt in, leo. Maecenas pulvinar lobortis est.",http://nytimes.com/etiam/pretium/iaculis/justo/in/hac/habitasse.json?dis=eu&parturient=interdum&montes=eu&nascetur=tincidunt&ridiculus=in&mus=leo&etiam=maecenas&vel=pulvinar&augue=lobortis&vestibulum=est&rutrum=phasellus&rutrum=sit&neque=amet&aenean=erat&auctor=nulla&gravida=tempus&sem=vivamus&praesent=in&id=felis&massa=eu&id=sapien&nisl=cursus,http://dummyimage.com/165x100.png/ff4444/ffffff,true
62,Thoughtblab,"Nulla ut erat id mauris vulputate elementum. Nullam varius. Nulla facilisi.

Cras non velit nec nisi vulputate nonummy. Maecenas tincidunt lacus at velit. Vivamus vel nulla eget eros elementum pellentesque.",http://blogspot.com/platea/dictumst/etiam/faucibus.aspx?id=non&nulla=velit&ultrices=donec&aliquet=diam&maecenas=neque&leo=vestibulum&odio=eget&condimentum=vulputate&id=ut&luctus=ultrices&nec=vel&molestie=augue&sed=vestibulum&justo=ante&pellentesque=ipsum&viverra=primis&pede=in&ac=faucibus&diam=orci&cras=luctus&pellentesque=et&volutpat=ultrices&dui=posuere&maecenas=cubilia&tristique=curae&est=donec&et=pharetra&tempus=magna&semper=vestibulum,http://dummyimage.com/195x100.png/5fa2dd/ffffff,false
63,Zazio,"In hac habitasse platea dictumst. Etiam faucibus cursus urna. Ut tellus.

Nulla ut erat id mauris vulputate elementum. Nullam varius. Nulla facilisi.

Cras non velit nec nisi vulputate nonummy. Maecenas tincidunt lacus at velit. Vivamus vel nulla eget eros elementum pellentesque.",https://elegantthemes.com/platea/dictumst/maecenas/ut/massa.html?aenean=vulputate&lectus=elementum&pellentesque=nullam&eget=varius&nunc=nulla,http://dummyimage.com/140x100.png/dddddd/000000,true
64,Blogpad,Phasellus in felis. Donec semper sapien a libero. Nam dui.,https://loc.gov/nulla/ut/erat/id.jpg?sit=augue&amet=vel&diam=accumsan&in=tellus&magna=nisi&bibendum=eu&imperdiet=orci&nullam=mauris&orci=lacinia&pede=sapien&venenatis=quis&non=libero&sodales=nullam&sed=sit&tincidunt=amet&eu=turpis&felis=elementum&fusce=ligula&posuere=vehicula&felis=consequat,http://dummyimage.com/233x100.png/ff4444/ffffff,true
65,Trilia,"Maecenas leo odio, condimentum id, luctus nec, molestie sed, justo. Pellentesque viverra pede ac diam. Cras pellentesque volutpat dui.",http://webs.com/dis.xml?odio=ac&odio=est&elementum=lacinia&eu=nisi&interdum=venenatis&eu=tristique&tincidunt=fusce&in=congue&leo=diam&maecenas=id&pulvinar=ornare&lobortis=imperdiet&est=sapien&phasellus=urna&sit=pretium&amet=nisl&erat=ut&nulla=volutpat&tempus=sapien&vivamus=arcu&in=sed&felis=augue&eu=aliquam&sapien=erat&cursus=volutpat&vestibulum=in&proin=congue&eu=etiam&mi=justo&nulla=etiam&ac=pretium&enim=iaculis&in=justo&tempor=in&turpis=hac&nec=habitasse,http://dummyimage.com/134x100.png/cc0000/ffffff,true
66,Browsetype,"Proin interdum mauris non ligula pellentesque ultrices. Phasellus id sapien in sapien iaculis congue. Vivamus metus arcu, adipiscing molestie, hendrerit at, vulputate vitae, nisl.",https://addtoany.com/convallis/morbi/odio/odio/elementum.jsp?orci=venenatis&luctus=turpis&et=enim&ultrices=blandit&posuere=mi&cubilia=in&curae=porttitor&nulla=pede&dapibus=justo&dolor=eu&vel=massa&est=donec&donec=dapibus&odio=duis&justo=at&sollicitudin=velit&ut=eu&suscipit=est&a=congue&feugiat=elementum&et=in&eros=hac&vestibulum=habitasse&ac=platea&est=dictumst&lacinia=morbi&nisi=vestibulum&venenatis=velit&tristique=id&fusce=pretium&congue=iaculis&diam=diam&id=erat&ornare=fermentum&imperdiet=justo&sapien=nec&urna=condimentum&pretium=neque&nisl=sapien&ut=placerat&volutpat=ante&sapien=nulla&arcu=justo&sed=aliquam&augue=quis&aliquam=turpis&erat=eget&volutpat=elit&in=sodales&congue=scelerisque&etiam=mauris&justo=sit&etiam=amet&pretium=eros&iaculis=suspendisse&justo=accumsan&in=tortor&hac=quis&habitasse=turpis&platea=sed&dictumst=ante&etiam=vivamus&faucibus=tortor&cursus=duis&urna=mattis&ut=egestas&tellus=metus&nulla=aenean&ut=fermentum&erat=donec&id=ut&mauris=mauris&vulputate=eget&elementum=massa&nullam=tempor&varius=convallis&nulla=nulla&facilisi=neque&cras=libero,http://dummyimage.com/139x100.png/dddddd/000000,true
67,Aivee,"Vestibulum ac est lacinia nisi venenatis tristique. Fusce congue, diam id ornare imperdiet, sapien urna pretium nisl, ut volutpat sapien arcu sed augue. Aliquam erat volutpat.",https://yelp.com/platea/dictumst/morbi/vestibulum/velit/id/pretium.aspx?gravida=aliquet&sem=ultrices&praesent=erat&id=tortor&massa=sollicitudin&id=mi&nisl=sit&venenatis=amet&lacinia=lobortis&aenean=sapien&sit=sapien&amet=non&justo=mi&morbi=integer&ut=ac&odio=neque&cras=duis&mi=bibendum&pede=morbi&malesuada=non&in=quam&imperdiet=nec&et=dui&commodo=luctus&vulputate=rutrum&justo=nulla&in=tellus&blandit=in&ultrices=sagittis&enim=dui&lorem=vel&ipsum=nisl&dolor=duis&sit=ac&amet=nibh&consectetuer=fusce&adipiscing=lacus&elit=purus&proin=aliquet&interdum=at,http://dummyimage.com/172x100.png/dddddd/000000,true
68,Realpoint,In hac habitasse platea dictumst. Etiam faucibus cursus urna. Ut tellus.,http://dell.com/in/sapien/iaculis/congue.xml?dictumst=dui&morbi=maecenas&vestibulum=tristique&velit=est&id=et&pretium=tempus&iaculis=semper&diam=est&erat=quam&fermentum=pharetra&justo=magna&nec=ac&condimentum=consequat&neque=metus&sapien=sapien&placerat=ut&ante=nunc&nulla=vestibulum&justo=ante&aliquam=ipsum&quis=primis&turpis=in&eget=faucibus&elit=orci&sodales=luctus&scelerisque=et&mauris=ultrices&sit=posuere&amet=cubilia&eros=curae&suspendisse=mauris&accumsan=viverra&tortor=diam&quis=vitae&turpis=quam&sed=suspendisse&ante=potenti&vivamus=nullam&tortor=porttitor&duis=lacus&mattis=at&egestas=turpis&metus=donec&aenean=posuere&fermentum=metus&donec=vitae&ut=ipsum&mauris=aliquam&eget=non&massa=mauris&tempor=morbi&convallis=non&nulla=lectus,http://dummyimage.com/207x100.png/5fa2dd/ffffff,true
69,Ozu,Aliquam quis turpis eget elit sodales scelerisque. Mauris sit amet eros. Suspendisse accumsan tortor quis turpis.,http://jigsy.com/eros/suspendisse/accumsan/tortor/quis.jpg?at=metus&velit=aenean&eu=fermentum&est=donec&congue=ut&elementum=mauris&in=eget&hac=massa&habitasse=tempor&platea=convallis&dictumst=nulla&morbi=neque&vestibulum=libero&velit=convallis&id=eget&pretium=eleifend&iaculis=luctus&diam=ultricies&erat=eu&fermentum=nibh&justo=quisque&nec=id&condimentum=justo&neque=sit&sapien=amet&placerat=sapien&ante=dignissim&nulla=vestibulum&justo=vestibulum&aliquam=ante&quis=ipsum&turpis=primis&eget=in&elit=faucibus&sodales=orci&scelerisque=luctus&mauris=et&sit=ultrices&amet=posuere&eros=cubilia&suspendisse=curae&accumsan=nulla&tortor=dapibus&quis=dolor&turpis=vel&sed=est&ante=donec&vivamus=odio&tortor=justo&duis=sollicitudin&mattis=ut&egestas=suscipit&metus=a&aenean=feugiat&fermentum=et&donec=eros&ut=vestibulum&mauris=ac&eget=est&massa=lacinia&tempor=nisi&convallis=venenatis&nulla=tristique&neque=fusce&libero=congue&convallis=diam&eget=id&eleifend=ornare&luctus=imperdiet&ultricies=sapien&eu=urna&nibh=pretium&quisque=nisl&id=ut&justo=volutpat&sit=sapien&amet=arcu,http://dummyimage.com/214x100.png/5fa2dd/ffffff,false
70,Avamm,"Cras non velit nec nisi vulputate nonummy. Maecenas tincidunt lacus at velit. Vivamus vel nulla eget eros elementum pellentesque.

Quisque porta volutpat erat. Quisque erat eros, viverra eget, congue eget, semper rutrum, nulla. Nunc purus.

Phasellus in felis. Donec semper sapien a libero. Nam dui.",https://google.com/nunc/proin/at/turpis/a/pede.js?sit=sed&amet=tristique&diam=in&in=tempus&magna=sit&bibendum=amet,http://dummyimage.com/239x100.png/dddddd/000000,false
71,Babbleblab,"Nullam porttitor lacus at turpis. Donec posuere metus vitae ipsum. Aliquam non mauris.

Morbi non lectus. Aliquam sit amet diam in magna bibendum imperdiet. Nullam orci pede, venenatis non, sodales sed, tincidunt eu, felis.

Fusce posuere felis sed lacus. Morbi sem mauris, laoreet ut, rhoncus aliquet, pulvinar sed, nisl. Nunc rhoncus dui vel sem.",http://harvard.edu/vel/nulla/eget/eros/elementum/pellentesque/quisque.xml?luctus=quam&et=sollicitudin&ultrices=vitae&posuere=consectetuer&cubilia=eget&curae=rutrum&donec=at&pharetra=lorem&magna=integer&vestibulum=tincidunt&aliquet=ante&ultrices=vel&erat=ipsum,http://dummyimage.com/126x100.png/cc0000/ffffff,true
72,Gabvine,"Proin interdum mauris non ligula pellentesque ultrices. Phasellus id sapien in sapien iaculis congue. Vivamus metus arcu, adipiscing molestie, hendrerit at, vulputate vitae, nisl.

Aenean lectus. Pellentesque eget nunc. Donec quis orci eget orci vehicula condimentum.

Curabitur in libero ut massa volutpat convallis. Morbi odio odio, elementum eu, interdum eu, tincidunt in, leo. Maecenas pulvinar lobortis est.",https://opera.com/sit/amet/justo/morbi/ut/odio.xml?ridiculus=tortor&mus=risus&vivamus=dapibus&vestibulum=augue&sagittis=vel&sapien=accumsan&cum=tellus&sociis=nisi&natoque=eu&penatibus=orci&et=mauris&magnis=lacinia&dis=sapien&parturient=quis&montes=libero&nascetur=nullam&ridiculus=sit&mus=amet&etiam=turpis&vel=elementum&augue=ligula&vestibulum=vehicula&rutrum=consequat&rutrum=morbi&neque=a&aenean=ipsum&auctor=integer&gravida=a&sem=nibh&praesent=in&id=quis&massa=justo&id=maecenas&nisl=rhoncus&venenatis=aliquam&lacinia=lacus&aenean=morbi&sit=quis&amet=tortor&justo=id&morbi=nulla&ut=ultrices&odio=aliquet&cras=maecenas&mi=leo&pede=odio&malesuada=condimentum&in=id&imperdiet=luctus&et=nec&commodo=molestie&vulputate=sed&justo=justo&in=pellentesque&blandit=viverra&ultrices=pede&enim=ac&lorem=diam&ipsum=cras&dolor=pellentesque&sit=volutpat&amet=dui&consectetuer=maecenas&adipiscing=tristique,http://dummyimage.com/144x100.png/dddddd/000000,false
73,Eazzy,"Phasellus in felis. Donec semper sapien a libero. Nam dui.

Proin leo odio, porttitor id, consequat in, consequat ut, nulla. Sed accumsan felis. Ut at dolor quis odio consequat varius.",http://google.fr/ut/massa.aspx?libero=sed&convallis=interdum&eget=venenatis&eleifend=turpis&luctus=enim&ultricies=blandit&eu=mi&nibh=in&quisque=porttitor&id=pede&justo=justo&sit=eu&amet=massa&sapien=donec&dignissim=dapibus&vestibulum=duis,http://dummyimage.com/180x100.png/ff4444/ffffff,true
74,Tekfly,"Quisque porta volutpat erat. Quisque erat eros, viverra eget, congue eget, semper rutrum, nulla. Nunc purus.",https://facebook.com/eros.jsp?felis=viverra&ut=pede&at=ac&dolor=diam&quis=cras&odio=pellentesque&consequat=volutpat&varius=dui,http://dummyimage.com/122x100.png/cc0000/ffffff,true
75,Jetwire,"Phasellus in felis. Donec semper sapien a libero. Nam dui.

Proin leo odio, porttitor id, consequat in, consequat ut, nulla. Sed accumsan felis. Ut at dolor quis odio consequat varius.",http://unicef.org/mauris/sit/amet.js?lorem=ante&quisque=ipsum&ut=primis&erat=in&curabitur=faucibus&gravida=orci&nisi=luctus&at=et&nibh=ultrices&in=posuere&hac=cubilia&habitasse=curae&platea=nulla&dictumst=dapibus&aliquam=dolor&augue=vel&quam=est&sollicitudin=donec&vitae=odio&consectetuer=justo&eget=sollicitudin&rutrum=ut&at=suscipit&lorem=a&integer=feugiat&tincidunt=et&ante=eros&vel=vestibulum&ipsum=ac&praesent=est&blandit=lacinia&lacinia=nisi&erat=venenatis&vestibulum=tristique&sed=fusce&magna=congue&at=diam&nunc=id&commodo=ornare&placerat=imperdiet&praesent=sapien&blandit=urna&nam=pretium&nulla=nisl&integer=ut&pede=volutpat&justo=sapien&lacinia=arcu&eget=sed&tincidunt=augue&eget=aliquam&tempus=erat&vel=volutpat&pede=in&morbi=congue&porttitor=etiam&lorem=justo&id=etiam&ligula=pretium&suspendisse=iaculis&ornare=justo&consequat=in&lectus=hac&in=habitasse&est=platea&risus=dictumst&auctor=etiam&sed=faucibus&tristique=cursus&in=urna&tempus=ut&sit=tellus&amet=nulla&sem=ut&fusce=erat&consequat=id&nulla=mauris&nisl=vulputate&nunc=elementum&nisl=nullam&duis=varius&bibendum=nulla&felis=facilisi&sed=cras&interdum=non&venenatis=velit&turpis=nec&enim=nisi,http://dummyimage.com/187x100.png/dddddd/000000,true
