firm_id,firm_name,description_firm,website,logo,inactif
103,Photofeed,"Duis bibendum. Morbi non quam nec dui luctus rutrum. Nulla tellus.

In sagittis dui vel nisl. Duis ac nibh. Fusce lacus purus, aliquet at, feugiat non, pretium quis, lectus.

Suspendisse potenti. In eleifend quam a odio. In hac habitasse platea dictumst.",http://wiley.com/sagittis.json?venenatis=rutrum&non=nulla&sodales=nunc&sed=purus,http://dummyimage.com/230x100.png/5fa2dd/ffffff,false
104,Aibox,"Curabitur gravida nisi at nibh. In hac habitasse platea dictumst. Aliquam augue quam, sollicitudin vitae, consectetuer eget, rutrum at, lorem.",https://msu.edu/luctus/rutrum/nulla/tellus/in/sagittis/dui.json?orci=ut&nullam=at&molestie=dolor&nibh=quis&in=odio&lectus=consequat&pellentesque=varius&at=integer&nulla=ac&suspendisse=leo&potenti=pellentesque&cras=ultrices&in=mattis&purus=odio&eu=donec&magna=vitae&vulputate=nisi&luctus=nam&cum=ultrices&sociis=libero&natoque=non&penatibus=mattis&et=pulvinar&magnis=nulla&dis=pede&parturient=ullamcorper&montes=augue&nascetur=a&ridiculus=suscipit&mus=nulla&vivamus=elit,http://dummyimage.com/241x100.png/ff4444/ffffff,true
105,Yadel,"Suspendisse potenti. In eleifend quam a odio. In hac habitasse platea dictumst.

Maecenas ut massa quis augue luctus tincidunt. Nulla mollis molestie lorem. Quisque ut erat.

Curabitur gravida nisi at nibh. In hac habitasse platea dictumst. Aliquam augue quam, sollicitudin vitae, consectetuer eget, rutrum at, lorem.",https://weather.com/nonummy.js?est=suspendisse&phasellus=potenti&sit=cras&amet=in&erat=purus&nulla=eu&tempus=magna&vivamus=vulputate&in=luctus&felis=cum&eu=sociis&sapien=natoque&cursus=penatibus&vestibulum=et&proin=magnis&eu=dis&mi=parturient&nulla=montes&ac=nascetur&enim=ridiculus&in=mus&tempor=vivamus&turpis=vestibulum&nec=sagittis&euismod=sapien&scelerisque=cum&quam=sociis&turpis=natoque&adipiscing=penatibus&lorem=et&vitae=magnis&mattis=dis&nibh=parturient&ligula=montes&nec=nascetur&sem=ridiculus&duis=mus&aliquam=etiam&convallis=vel&nunc=augue&proin=vestibulum&at=rutrum&turpis=rutrum&a=neque&pede=aenean&posuere=auctor&nonummy=gravida&integer=sem&non=praesent&velit=id&donec=massa&diam=id&neque=nisl&vestibulum=venenatis&eget=lacinia&vulputate=aenean&ut=sit&ultrices=amet&vel=justo&augue=morbi&vestibulum=ut&ante=odio&ipsum=cras&primis=mi&in=pede&faucibus=malesuada&orci=in&luctus=imperdiet&et=et&ultrices=commodo&posuere=vulputate&cubilia=justo&curae=in&donec=blandit&pharetra=ultrices&magna=enim&vestibulum=lorem&aliquet=ipsum&ultrices=dolor&erat=sit&tortor=amet&sollicitudin=consectetuer,http://dummyimage.com/109x100.png/5fa2dd/ffffff,true
106,Kimia,"Nam ultrices, libero non mattis pulvinar, nulla pede ullamcorper augue, a suscipit nulla elit ac nulla. Sed vel enim sit amet nunc viverra dapibus. Nulla suscipit ligula in lacus.

Curabitur at ipsum ac tellus semper interdum. Mauris ullamcorper purus sit amet nulla. Quisque arcu libero, rutrum ac, lobortis vel, dapibus at, diam.",https://shinystat.com/non/sodales.jpg?orci=turpis&mauris=integer&lacinia=aliquet&sapien=massa&quis=id&libero=lobortis&nullam=convallis&sit=tortor&amet=risus&turpis=dapibus&elementum=augue&ligula=vel&vehicula=accumsan&consequat=tellus&morbi=nisi&a=eu&ipsum=orci&integer=mauris&a=lacinia&nibh=sapien&in=quis&quis=libero&justo=nullam&maecenas=sit&rhoncus=amet&aliquam=turpis&lacus=elementum&morbi=ligula&quis=vehicula&tortor=consequat&id=morbi&nulla=a&ultrices=ipsum&aliquet=integer&maecenas=a&leo=nibh&odio=in&condimentum=quis&id=justo&luctus=maecenas&nec=rhoncus&molestie=aliquam&sed=lacus&justo=morbi&pellentesque=quis&viverra=tortor&pede=id&ac=nulla&diam=ultrices&cras=aliquet&pellentesque=maecenas&volutpat=leo&dui=odio&maecenas=condimentum&tristique=id&est=luctus&et=nec&tempus=molestie&semper=sed&est=justo&quam=pellentesque&pharetra=viverra&magna=pede&ac=ac&consequat=diam&metus=cras&sapien=pellentesque&ut=volutpat&nunc=dui&vestibulum=maecenas&ante=tristique&ipsum=est&primis=et&in=tempus&faucibus=semper&orci=est,http://dummyimage.com/124x100.png/dddddd/000000,true
107,Babbleset,"In hac habitasse platea dictumst. Morbi vestibulum, velit id pretium iaculis, diam erat fermentum justo, nec condimentum neque sapien placerat ante. Nulla justo.

Aliquam quis turpis eget elit sodales scelerisque. Mauris sit amet eros. Suspendisse accumsan tortor quis turpis.

Sed ante. Vivamus tortor. Duis mattis egestas metus.",https://google.com.hk/maecenas/ut/massa/quis.html?orci=erat&mauris=tortor&lacinia=sollicitudin&sapien=mi&quis=sit&libero=amet&nullam=lobortis&sit=sapien&amet=sapien&turpis=non&elementum=mi&ligula=integer&vehicula=ac&consequat=neque&morbi=duis&a=bibendum&ipsum=morbi&integer=non&a=quam&nibh=nec&in=dui&quis=luctus&justo=rutrum&maecenas=nulla&rhoncus=tellus&aliquam=in&lacus=sagittis&morbi=dui&quis=vel&tortor=nisl&id=duis&nulla=ac&ultrices=nibh&aliquet=fusce&maecenas=lacus&leo=purus&odio=aliquet&condimentum=at&id=feugiat&luctus=non,http://dummyimage.com/226x100.png/cc0000/ffffff,false
108,Youopia,"Donec diam neque, vestibulum eget, vulputate ut, ultrices vel, augue. Vestibulum ante ipsum primis in faucibus orci luctus et ultrices posuere cubilia Curae; Donec pharetra, magna vestibulum aliquet ultrices, erat tortor sollicitudin mi, sit amet lobortis sapien sapien non mi. Integer ac neque.

Duis bibendum. Morbi non quam nec dui luctus rutrum. Nulla tellus.",https://kickstarter.com/luctus/et/ultrices/posuere/cubilia.js?quisque=sit&id=amet&justo=consectetuer&sit=adipiscing&amet=elit&sapien=proin&dignissim=risus&vestibulum=praesent&vestibulum=lectus&ante=vestibulum&ipsum=quam&primis=sapien&in=varius&faucibus=ut&orci=blandit&luctus=non&et=interdum&ultrices=in&posuere=ante&cubilia=vestibulum&curae=ante&nulla=ipsum&dapibus=primis&dolor=in&vel=faucibus&est=orci&donec=luctus&odio=et&justo=ultrices&sollicitudin=posuere&ut=cubilia&suscipit=curae&a=duis&feugiat=faucibus&et=accumsan&eros=odio&vestibulum=curabitur&ac=convallis&est=duis&lacinia=consequat&nisi=dui&venenatis=nec&tristique=nisi&fusce=volutpat&congue=eleifend&diam=donec,http://dummyimage.com/220x100.png/5fa2dd/ffffff,true
109,Dynabox,Duis consequat dui nec nisi volutpat eleifend. Donec ut dolor. Morbi vel lectus in quam fringilla rhoncus.,https://yale.edu/nibh/in.jpg?eu=non&nibh=velit&quisque=nec&id=nisi&justo=vulputate&sit=nonummy&amet=maecenas&sapien=tincidunt&dignissim=lacus&vestibulum=at&vestibulum=velit&ante=vivamus&ipsum=vel&primis=nulla&in=eget&faucibus=eros&orci=elementum&luctus=pellentesque&et=quisque&ultrices=porta&posuere=volutpat&cubilia=erat&curae=quisque&nulla=erat&dapibus=eros&dolor=viverra&vel=eget&est=congue&donec=eget&odio=semper&justo=rutrum&sollicitudin=nulla&ut=nunc,http://dummyimage.com/198x100.png/5fa2dd/ffffff,false
110,Kaymbo,"Maecenas ut massa quis augue luctus tincidunt. Nulla mollis molestie lorem. Quisque ut erat.

Curabitur gravida nisi at nibh. In hac habitasse platea dictumst. Aliquam augue quam, sollicitudin vitae, consectetuer eget, rutrum at, lorem.",http://sciencedaily.com/tortor/quis/turpis/sed/ante.xml?convallis=lorem&tortor=ipsum&risus=dolor&dapibus=sit&augue=amet&vel=consectetuer&accumsan=adipiscing&tellus=elit&nisi=proin&eu=interdum&orci=mauris&mauris=non&lacinia=ligula&sapien=pellentesque&quis=ultrices&libero=phasellus&nullam=id&sit=sapien,http://dummyimage.com/121x100.png/dddddd/000000,false
111,Topicshots,"Lorem ipsum dolor sit amet, consectetuer adipiscing elit. Proin risus. Praesent lectus.

Vestibulum quam sapien, varius ut, blandit non, interdum in, ante. Vestibulum ante ipsum primis in faucibus orci luctus et ultrices posuere cubilia Curae; Duis faucibus accumsan odio. Curabitur convallis.",http://bloglines.com/at/velit/vivamus.png?platea=integer&dictumst=ac&aliquam=leo&augue=pellentesque&quam=ultrices&sollicitudin=mattis&vitae=odio&consectetuer=donec&eget=vitae&rutrum=nisi&at=nam&lorem=ultrices&integer=libero&tincidunt=non,http://dummyimage.com/157x100.png/dddddd/000000,false
112,Devshare,"Lorem ipsum dolor sit amet, consectetuer adipiscing elit. Proin risus. Praesent lectus.

Vestibulum quam sapien, varius ut, blandit non, interdum in, ante. Vestibulum ante ipsum primis in faucibus orci luctus et ultrices posuere cubilia Curae; Duis faucibus accumsan odio. Curabitur convallis.

Duis consequat dui nec nisi volutpat eleifend. Donec ut dolor. Morbi vel lectus in quam fringilla rhoncus.",https://eepurl.com/sagittis/nam/congue/risus.jpg?eget=erat&tempus=tortor&vel=sollicitudin&pede=mi&morbi=sit&porttitor=amet&lorem=lobortis&id=sapien&ligula=sapien&suspendisse=non&ornare=mi&consequat=integer&lectus=ac&in=neque&est=duis&risus=bibendum&auctor=morbi&sed=non&tristique=quam&in=nec&tempus=dui&sit=luctus&amet=rutrum&sem=nulla&fusce=tellus&consequat=in&nulla=sagittis&nisl=dui&nunc=vel&nisl=nisl&duis=duis&bibendum=ac&felis=nibh&sed=fusce&interdum=lacus&venenatis=purus&turpis=aliquet&enim=at&blandit=feugiat&mi=non&in=pretium&porttitor=quis&pede=lectus&justo=suspendisse&eu=potenti&massa=in&donec=eleifend&dapibus=quam&duis=a&at=odio&velit=in&eu=hac&est=habitasse&congue=platea&elementum=dictumst&in=maecenas&hac=ut&habitasse=massa&platea=quis&dictumst=augue&morbi=luctus&vestibulum=tincidunt&velit=nulla&id=mollis&pretium=molestie&iaculis=lorem&diam=quisque&erat=ut&fermentum=erat&justo=curabitur&nec=gravida&condimentum=nisi&neque=at&sapien=nibh&placerat=in&ante=hac&nulla=habitasse&justo=platea&aliquam=dictumst&quis=aliquam&turpis=augue&eget=quam&elit=sollicitudin&sodales=vitae&scelerisque=consectetuer&mauris=eget&sit=rutrum&amet=at&eros=lorem&suspendisse=integer&accumsan=tincidunt&tortor=ante&quis=vel&turpis=ipsum&sed=praesent&ante=blandit&vivamus=lacinia&tortor=erat&duis=vestibulum,http://dummyimage.com/164x100.png/ff4444/ffffff,true
113,Leexo,"Morbi porttitor lorem id ligula. Suspendisse ornare consequat lectus. In est risus, auctor sed, tristique in, tempus sit amet, sem.

Fusce consequat. Nulla nisl. Nunc nisl.

Duis bibendum, felis sed interdum venenatis, turpis enim blandit mi, in porttitor pede justo eu massa. Donec dapibus. Duis at velit eu est congue elementum.",https://samsung.com/maecenas/leo.json?curae=est&nulla=congue&dapibus=elementum&dolor=in&vel=hac&est=habitasse&donec=platea&odio=dictumst&justo=morbi&sollicitudin=vestibulum&ut=velit&suscipit=id&a=pretium&feugiat=iaculis&et=diam&eros=erat&vestibulum=fermentum&ac=justo&est=nec&lacinia=condimentum&nisi=neque&venenatis=sapien&tristique=placerat&fusce=ante&congue=nulla&diam=justo&id=aliquam&ornare=quis&imperdiet=turpis&sapien=eget&urna=elit&pretium=sodales&nisl=scelerisque&ut=mauris,http://dummyimage.com/199x100.png/cc0000/ffffff,true
114,Devify,Fusce consequat. Nulla nisl. Nunc nisl.,http://ask.com/elit/sodales/scelerisque/mauris/sit/amet/eros.js?ultrices=id&enim=consequat&lorem=in&ipsum=consequat&dolor=ut&sit=nulla&amet=sed&consectetuer=accumsan&adipiscing=felis&elit=ut&proin=at&interdum=dolor&mauris=quis&non=odio&ligula=consequat&pellentesque=varius&ultrices=integer&phasellus=ac&id=leo&sapien=pellentesque&in=ultrices&sapien=mattis&iaculis=odio&congue=donec&vivamus=vitae,http://dummyimage.com/233x100.png/5fa2dd/ffffff,false
115,Zoombeat,"Aenean lectus. Pellentesque eget nunc. Donec quis orci eget orci vehicula condimentum.

Curabitur in libero ut massa volutpat convallis. Morbi odio odio, elementum eu, interdum eu, tincidunt in, leo. Maecenas pulvinar lobortis est.",http://fema.gov/ultrices/libero/non/mattis.json?ipsum=morbi&primis=non&in=quam&faucibus=nec&orci=dui&luctus=luctus&et=rutrum&ultrices=nulla&posuere=tellus&cubilia=in&curae=sagittis&mauris=dui&viverra=vel&diam=nisl&vitae=duis&quam=ac&suspendisse=nibh&potenti=fusce&nullam=lacus&porttitor=purus&lacus=aliquet&at=at&turpis=feugiat&donec=non&posuere=pretium&metus=quis&vitae=lectus&ipsum=suspendisse&aliquam=potenti&non=in&mauris=eleifend&morbi=quam&non=a&lectus=odio&aliquam=in&sit=hac&amet=habitasse&diam=platea&in=dictumst&magna=maecenas&bibendum=ut&imperdiet=massa&nullam=quis,http://dummyimage.com/156x100.png/ff4444/ffffff,true
116,Tagfeed,"Lorem ipsum dolor sit amet, consectetuer adipiscing elit. Proin risus. Praesent lectus.

Vestibulum quam sapien, varius ut, blandit non, interdum in, ante. Vestibulum ante ipsum primis in faucibus orci luctus et ultrices posuere cubilia Curae; Duis faucibus accumsan odio. Curabitur convallis.

Duis consequat dui nec nisi volutpat eleifend. Donec ut dolor. Morbi vel lectus in quam fringilla rhoncus.",https://accuweather.com/convallis.xml?dis=adipiscing&parturient=elit&montes=proin&nascetur=interdum&ridiculus=mauris&mus=non&vivamus=ligula&vestibulum=pellentesque&sagittis=ultrices&sapien=phasellus&cum=id&sociis=sapien&natoque=in&penatibus=sapien&et=iaculis&magnis=congue&dis=vivamus&parturient=metus&montes=arcu&nascetur=adipiscing&ridiculus=molestie&mus=hendrerit&etiam=at&vel=vulputate&augue=vitae&vestibulum=nisl&rutrum=aenean&rutrum=lectus&neque=pellentesque&aenean=eget&auctor=nunc&gravida=donec&sem=quis&praesent=orci&id=eget&massa=orci&id=vehicula&nisl=condimentum&venenatis=curabitur&lacinia=in&aenean=libero&sit=ut&amet=massa&justo=volutpat&morbi=convallis&ut=morbi&odio=odio&cras=odio&mi=elementum&pede=eu&malesuada=interdum&in=eu&imperdiet=tincidunt&et=in&commodo=leo&vulputate=maecenas&justo=pulvinar&in=lobortis&blandit=est&ultrices=phasellus&enim=sit&lorem=amet&ipsum=erat&dolor=nulla&sit=tempus&amet=vivamus&consectetuer=in&adipiscing=felis&elit=eu&proin=sapien&interdum=cursus&mauris=vestibulum&non=proin&ligula=eu&pellentesque=mi&ultrices=nulla&phasellus=ac&id=enim&sapien=in&in=tempor&sapien=turpis&iaculis=nec&congue=euismod&vivamus=scelerisque&metus=quam&arcu=turpis&adipiscing=adipiscing&molestie=lorem&hendrerit=vitae&at=mattis&vulputate=nibh&vitae=ligula&nisl=nec&aenean=sem&lectus=duis&pellentesque=aliquam&eget=convallis&nunc=nunc&donec=proin&quis=at,http://dummyimage.com/114x100.png/dddddd/000000,true
117,Jetwire,"Aenean fermentum. Donec ut mauris eget massa tempor convallis. Nulla neque libero, convallis eget, eleifend luctus, ultricies eu, nibh.

Quisque id justo sit amet sapien dignissim vestibulum. Vestibulum ante ipsum primis in faucibus orci luctus et ultrices posuere cubilia Curae; Nulla dapibus dolor vel est. Donec odio justo, sollicitudin ut, suscipit a, feugiat et, eros.",http://state.gov/morbi/non/quam/nec/dui/luctus.jsp?vulputate=at&nonummy=vulputate&maecenas=vitae&tincidunt=nisl&lacus=aenean&at=lectus&velit=pellentesque&vivamus=eget&vel=nunc&nulla=donec&eget=quis&eros=orci&elementum=eget&pellentesque=orci&quisque=vehicula&porta=condimentum&volutpat=curabitur&erat=in&quisque=libero&erat=ut&eros=massa&viverra=volutpat&eget=convallis&congue=morbi&eget=odio&semper=odio&rutrum=elementum&nulla=eu&nunc=interdum&purus=eu&phasellus=tincidunt&in=in&felis=leo&donec=maecenas,http://dummyimage.com/170x100.png/5fa2dd/ffffff,true
118,Dynazzy,"Aenean fermentum. Donec ut mauris eget massa tempor convallis. Nulla neque libero, convallis eget, eleifend luctus, ultricies eu, nibh.

Quisque id justo sit amet sapien dignissim vestibulum. Vestibulum ante ipsum primis in faucibus orci luctus et ultrices posuere cubilia Curae; Nulla dapibus dolor vel est. Donec odio justo, sollicitudin ut, suscipit a, feugiat et, eros.",https://myspace.com/nulla/eget/eros.png?quis=felis&orci=ut&nullam=at&molestie=dolor&nibh=quis&in=odio&lectus=consequat&pellentesque=varius&at=integer&nulla=ac&suspendisse=leo&potenti=pellentesque&cras=ultrices&in=mattis&purus=odio&eu=donec&magna=vitae&vulputate=nisi&luctus=nam&cum=ultrices&sociis=libero&natoque=non&penatibus=mattis&et=pulvinar&magnis=nulla&dis=pede&parturient=ullamcorper&montes=augue&nascetur=a&ridiculus=suscipit&mus=nulla,http://dummyimage.com/231x100.png/cc0000/ffffff,false
119,Tazzy,"In congue. Etiam justo. Etiam pretium iaculis justo.

In hac habitasse platea dictumst. Etiam faucibus cursus urna. Ut tellus.

Nulla ut erat id mauris vulputate elementum. Nullam varius. Nulla facilisi.",http://wix.com/integer/aliquet/massa/id/lobortis/convallis/tortor.aspx?consectetuer=accumsan&eget=tortor&rutrum=quis&at=turpis&lorem=sed&integer=ante&tincidunt=vivamus&ante=tortor&vel=duis&ipsum=mattis&praesent=egestas&blandit=metus&lacinia=aenean&erat=fermentum&vestibulum=donec&sed=ut&magna=mauris&at=eget&nunc=massa&commodo=tempor&placerat=convallis&praesent=nulla&blandit=neque&nam=libero&nulla=convallis&integer=eget&pede=eleifend&justo=luctus&lacinia=ultricies&eget=eu&tincidunt=nibh&eget=quisque&tempus=id&vel=justo&pede=sit&morbi=amet&porttitor=sapien&lorem=dignissim&id=vestibulum&ligula=vestibulum&suspendisse=ante&ornare=ipsum&consequat=primis&lectus=in&in=faucibus&est=orci&risus=luctus&auctor=et&sed=ultrices&tristique=posuere&in=cubilia&tempus=curae&sit=nulla&amet=dapibus&sem=dolor&fusce=vel&consequat=est&nulla=donec&nisl=odio&nunc=justo&nisl=sollicitudin&duis=ut&bibendum=suscipit&felis=a&sed=feugiat&interdum=et&venenatis=eros&turpis=vestibulum&enim=ac&blandit=est&mi=lacinia&in=nisi&porttitor=venenatis&pede=tristique&justo=fusce&eu=congue&massa=diam&donec=id&dapibus=ornare&duis=imperdiet&at=sapien&velit=urna&eu=pretium&est=nisl&congue=ut&elementum=volutpat&in=sapien&hac=arcu&habitasse=sed&platea=augue&dictumst=aliquam&morbi=erat&vestibulum=volutpat&velit=in,http://dummyimage.com/231x100.png/ff4444/ffffff,true
120,Livefish,"Praesent id massa id nisl venenatis lacinia. Aenean sit amet justo. Morbi ut odio.

Cras mi pede, malesuada in, imperdiet et, commodo vulputate, justo. In blandit ultrices enim. Lorem ipsum dolor sit amet, consectetuer adipiscing elit.",https://jalbum.net/consequat/metus/sapien/ut/nunc/vestibulum.xml?magnis=congue&dis=elementum&parturient=in&montes=hac&nascetur=habitasse&ridiculus=platea&mus=dictumst&etiam=morbi&vel=vestibulum&augue=velit&vestibulum=id&rutrum=pretium&rutrum=iaculis&neque=diam&aenean=erat&auctor=fermentum&gravida=justo&sem=nec&praesent=condimentum&id=neque&massa=sapien&id=placerat&nisl=ante&venenatis=nulla&lacinia=justo&aenean=aliquam&sit=quis&amet=turpis&justo=eget&morbi=elit&ut=sodales&odio=scelerisque&cras=mauris&mi=sit&pede=amet&malesuada=eros&in=suspendisse&imperdiet=accumsan&et=tortor&commodo=quis&vulputate=turpis&justo=sed&in=ante&blandit=vivamus&ultrices=tortor&enim=duis,http://dummyimage.com/143x100.png/ff4444/ffffff,true
121,Yoveo,"Aenean lectus. Pellentesque eget nunc. Donec quis orci eget orci vehicula condimentum.

Curabitur in libero ut massa volutpat convallis. Morbi odio odio, elementum eu, interdum eu, tincidunt in, leo. Maecenas pulvinar lobortis est.

Phasellus sit amet erat. Nulla tempus. Vivamus in felis eu sapien cursus vestibulum.",https://linkedin.com/nullam/sit/amet/turpis/elementum/ligula/vehicula.json?dapibus=ligula&augue=pellentesque&vel=ultrices&accumsan=phasellus&tellus=id&nisi=sapien&eu=in&orci=sapien&mauris=iaculis&lacinia=congue&sapien=vivamus&quis=metus&libero=arcu&nullam=adipiscing&sit=molestie&amet=hendrerit&turpis=at&elementum=vulputate&ligula=vitae&vehicula=nisl&consequat=aenean&morbi=lectus&a=pellentesque&ipsum=eget&integer=nunc&a=donec&nibh=quis&in=orci&quis=eget&justo=orci&maecenas=vehicula&rhoncus=condimentum&aliquam=curabitur&lacus=in&morbi=libero,http://dummyimage.com/237x100.png/dddddd/000000,false
122,Feedfire,"Donec diam neque, vestibulum eget, vulputate ut, ultrices vel, augue. Vestibulum ante ipsum primis in faucibus orci luctus et ultrices posuere cubilia Curae; Donec pharetra, magna vestibulum aliquet ultrices, erat tortor sollicitudin mi, sit amet lobortis sapien sapien non mi. Integer ac neque.",http://amazon.co.jp/in/faucibus/orci/luctus/et/ultrices/posuere.jsp?a=duis&ipsum=consequat&integer=dui&a=nec&nibh=nisi&in=volutpat&quis=eleifend&justo=donec&maecenas=ut&rhoncus=dolor&aliquam=morbi&lacus=vel&morbi=lectus&quis=in&tortor=quam&id=fringilla&nulla=rhoncus,http://dummyimage.com/228x100.png/dddddd/000000,true
123,Wikido,"Vestibulum quam sapien, varius ut, blandit non, interdum in, ante. Vestibulum ante ipsum primis in faucibus orci luctus et ultrices posuere cubilia Curae; Duis faucibus accumsan odio. Curabitur convallis.

Duis consequat dui nec nisi volutpat eleifend. Donec ut dolor. Morbi vel lectus in quam fringilla rhoncus.

Mauris enim leo, rhoncus sed, vestibulum sit amet, cursus id, turpis. Integer aliquet, massa id lobortis convallis, tortor risus dapibus augue, vel accumsan tellus nisi eu orci. Mauris lacinia sapien quis libero.",https://census.gov/pretium/quis.json?congue=ut&etiam=blandit&justo=non&etiam=interdum&pretium=in&iaculis=ante&justo=vestibulum&in=ante&hac=ipsum&habitasse=primis&platea=in&dictumst=faucibus&etiam=orci&faucibus=luctus&cursus=et&urna=ultrices&ut=posuere&tellus=cubilia&nulla=curae&ut=duis&erat=faucibus&id=accumsan&mauris=odio&vulputate=curabitur&elementum=convallis&nullam=duis&varius=consequat&nulla=dui&facilisi=nec&cras=nisi&non=volutpat&velit=eleifend&nec=donec&nisi=ut&vulputate=dolor&nonummy=morbi&maecenas=vel&tincidunt=lectus&lacus=in&at=quam&velit=fringilla&vivamus=rhoncus&vel=mauris&nulla=enim&eget=leo&eros=rhoncus&elementum=sed&pellentesque=vestibulum&quisque=sit&porta=amet&volutpat=cursus&erat=id&quisque=turpis&erat=integer&eros=aliquet&viverra=massa&eget=id&congue=lobortis&eget=convallis&semper=tortor&rutrum=risus&nulla=dapibus&nunc=augue&purus=vel&phasellus=accumsan&in=tellus&felis=nisi&donec=eu&semper=orci&sapien=mauris&a=lacinia&libero=sapien&nam=quis&dui=libero&proin=nullam&leo=sit&odio=amet&porttitor=turpis&id=elementum&consequat=ligula&in=vehicula&consequat=consequat&ut=morbi&nulla=a&sed=ipsum&accumsan=integer&felis=a&ut=nibh&at=in&dolor=quis&quis=justo&odio=maecenas&consequat=rhoncus&varius=aliquam&integer=lacus&ac=morbi,http://dummyimage.com/231x100.png/dddddd/000000,true
124,Zava,"Nulla ut erat id mauris vulputate elementum. Nullam varius. Nulla facilisi.

Cras non velit nec nisi vulputate nonummy. Maecenas tincidunt lacus at velit. Vivamus vel nulla eget eros elementum pellentesque.",https://google.com.hk/sit/amet/cursus/id/turpis.xml?ultrices=semper&erat=rutrum&tortor=nulla&sollicitudin=nunc&mi=purus&sit=phasellus&amet=in&lobortis=felis&sapien=donec&sapien=semper&non=sapien,http://dummyimage.com/154x100.png/cc0000/ffffff,true
125,Youopia,"In congue. Etiam justo. Etiam pretium iaculis justo.

In hac habitasse platea dictumst. Etiam faucibus cursus urna. Ut tellus.

Nulla ut erat id mauris vulputate elementum. Nullam varius. Nulla facilisi.",http://hugedomains.com/duis/bibendum/felis/sed/interdum/venenatis.xml?sed=id&ante=luctus&vivamus=nec&tortor=molestie&duis=sed&mattis=justo&egestas=pellentesque&metus=viverra&aenean=pede&fermentum=ac&donec=diam&ut=cras&mauris=pellentesque&eget=volutpat&massa=dui&tempor=maecenas&convallis=tristique&nulla=est&neque=et&libero=tempus&convallis=semper&eget=est&eleifend=quam&luctus=pharetra&ultricies=magna&eu=ac&nibh=consequat&quisque=metus&id=sapien&justo=ut&sit=nunc&amet=vestibulum&sapien=ante&dignissim=ipsum&vestibulum=primis&vestibulum=in&ante=faucibus&ipsum=orci&primis=luctus&in=et&faucibus=ultrices&orci=posuere&luctus=cubilia&et=curae&ultrices=mauris&posuere=viverra&cubilia=diam&curae=vitae&nulla=quam&dapibus=suspendisse&dolor=potenti&vel=nullam&est=porttitor&donec=lacus&odio=at&justo=turpis&sollicitudin=donec&ut=posuere&suscipit=metus&a=vitae&feugiat=ipsum&et=aliquam&eros=non&vestibulum=mauris&ac=morbi&est=non&lacinia=lectus&nisi=aliquam&venenatis=sit&tristique=amet&fusce=diam&congue=in&diam=magna&id=bibendum&ornare=imperdiet&imperdiet=nullam&sapien=orci&urna=pede&pretium=venenatis&nisl=non&ut=sodales&volutpat=sed&sapien=tincidunt&arcu=eu&sed=felis&augue=fusce&aliquam=posuere&erat=felis&volutpat=sed&in=lacus&congue=morbi&etiam=sem&justo=mauris&etiam=laoreet&pretium=ut&iaculis=rhoncus&justo=aliquet&in=pulvinar&hac=sed,http://dummyimage.com/203x100.png/5fa2dd/ffffff,false
126,Jaloo,"Quisque porta volutpat erat. Quisque erat eros, viverra eget, congue eget, semper rutrum, nulla. Nunc purus.

Phasellus in felis. Donec semper sapien a libero. Nam dui.

Proin leo odio, porttitor id, consequat in, consequat ut, nulla. Sed accumsan felis. Ut at dolor quis odio consequat varius.",https://sfgate.com/bibendum/imperdiet/nullam.html?adipiscing=nec&elit=condimentum&proin=neque&risus=sapien&praesent=placerat&lectus=ante&vestibulum=nulla&quam=justo&sapien=aliquam&varius=quis&ut=turpis&blandit=eget&non=elit&interdum=sodales&in=scelerisque&ante=mauris&vestibulum=sit&ante=amet&ipsum=eros&primis=suspendisse&in=accumsan&faucibus=tortor&orci=quis&luctus=turpis&et=sed&ultrices=ante&posuere=vivamus&cubilia=tortor,http://dummyimage.com/233x100.png/5fa2dd/ffffff,false
127,Pixoboo,"Sed ante. Vivamus tortor. Duis mattis egestas metus.

Aenean fermentum. Donec ut mauris eget massa tempor convallis. Nulla neque libero, convallis eget, eleifend luctus, ultricies eu, nibh.",http://shareasale.com/velit/eu/est/congue.png?orci=sit&pede=amet&venenatis=consectetuer&non=adipiscing&sodales=elit&sed=proin&tincidunt=interdum&eu=mauris&felis=non&fusce=ligula&posuere=pellentesque&felis=ultrices&sed=phasellus&lacus=id&morbi=sapien&sem=in&mauris=sapien&laoreet=iaculis&ut=congue&rhoncus=vivamus&aliquet=metus&pulvinar=arcu&sed=adipiscing&nisl=molestie&nunc=hendrerit&rhoncus=at&dui=vulputate&vel=vitae&sem=nisl&sed=aenean&sagittis=lectus&nam=pellentesque&congue=eget&risus=nunc&semper=donec&porta=quis&volutpat=orci&quam=eget&pede=orci&lobortis=vehicula&ligula=condimentum&sit=curabitur&amet=in&eleifend=libero&pede=ut&libero=massa&quis=volutpat&orci=convallis&nullam=morbi&molestie=odio&nibh=odio&in=elementum&lectus=eu&pellentesque=interdum&at=eu&nulla=tincidunt&suspendisse=in&potenti=leo&cras=maecenas&in=pulvinar&purus=lobortis&eu=est&magna=phasellus&vulputate=sit&luctus=amet&cum=erat&sociis=nulla&natoque=tempus&penatibus=vivamus&et=in&magnis=felis&dis=eu&parturient=sapien&montes=cursus&nascetur=vestibulum&ridiculus=proin&mus=eu&vivamus=mi&vestibulum=nulla&sagittis=ac&sapien=enim,http://dummyimage.com/199x100.png/cc0000/ffffff,false
